description,rationale,use_case,impact_area,transferability_score,actionability_rating,evidence_strength,type_(form),tag_(application),unique?,role,function,company,industry,country,date,source_(interview_#_/_name),link,notes
Require PMs to include a 'support load impact' estimate in new feature briefs.,Aligns product growth with ops capacity.,Product development intake,Efficiency,1,3,Anecdotal,Guideline,Feature Design/Resource Management,Y,Product Manager,Product Management,,SaaS,,2025-08-01 00:00:00,Zendesk PM Best Practices,nan,nan
The product's external website is often the best source for sales reps.,"An external site is often the most updated and consistent source of information on products, promos, and pricing.",Creating a single source of truth for a sales team.,Efficiency,4,3,Observed,warning,Sales Enablement,N,"PM, Marketing","Product, Marketing",,B2B SaaS,,2024-02-01 00:00:00,zenabled.weebly.com,http://zenabled.weebly.com/customer-interviews.html,This is a red flag about internal knowledge management and communication failures.
Avoid multitasking by focusing on one thing at a time.,Constantly switching between tasks leads to more errors and takes longer to finish the work.,Day-to-day work for a PM.,Efficiency,5,5,Peer-validated,rule-of-thumb,Time Management,N,PM,Product Development,,,,2024-05-01 00:00:00,zeda.io/blog/productivity-hacks-for-product-managers,It's better to work through a prioritized list sequentially to achieve more with fewer errors.,nan
"Implement the ""4 D's"" rule: Do, Delegate, Defer, or Delete.","This framework helps triage a constant influx of tasks, reducing mental clutter and improving focus.",Managing a busy day with competing priorities.,Efficiency,5,5,Observed,rule-of-thumb,Time Management,N,"PM, Manager",Product Development,,,,2024-05-01 00:00:00,zeda.io/blog/productivity-hacks-for-product-managers,The most effective hack is to delete tasks that don't advance any of your goals.,nan
"Use the ""2-minute rule"" to handle small tasks immediately.",Postponing simple tasks like sending an email creates a backlog and adds unnecessary mental burden.,Daily task management for a PM.,Efficiency,5,5,Observed,rule-of-thumb,Time Management,N,"PM, Manager",Product Development,,,,2024-05-01 00:00:00,zeda.io/blog/productivity-hacks-for-product-managers,Prevents a to-do list from becoming a source of stress and mental fog.,nan
"When AI-generated code fails, reframe the prompt as if the code was written by you to get better debugging help.","LLMs often respond more helpfully when asked to fix user-written code rather than defend their own prior output, reducing hallucinated justifications.",Debugging with AI tools,Efficiency,5,5,Peer-validated,workaround,Workaround,N,Software Engineer,Engineering,LegalZoom,Technology,US,2025-08-10 00:00:00,Yaroslav Lapin (LinkedIn Post,https://www.linkedin.com/posts/yaroslav-lapin_pro-tip-since-gpt-5-is-very-good-at-activity-7100000000000000000,A workaround reflecting behavioral patterns of LLMs like GPT-5 when approached with reframed prompts.
Take 5–10 minutes pre-meeting to list what you'll say and what input you need from seniors.,Makes check-ins decisive; shows ownership of your workstream.,Manager/partner catch-ups; internal standups.,Efficiency,1,4,Observed,cue,"Planning, Communication",N,Consultant,Consulting,Wall Street Oasis,Consulting,nan,2023-04-01 00:00:00,"WSO user ""Works at Bain"" (Most Helpful",https://www.wallstreetoasis.com/forum/consulting/year-1-in-consulting-tips-tricks-advice-and-unspoken-rules,Treat every touchpoint like a mini-review with a clear ask.
Listen first; try to infer the rationale before asking 'why not X?'.,Keeps velocity high when seniors can't over-explain every task.,Receiving tasks from case lead/partner.,Efficiency,1,4,Observed,cue,"Team Dynamics, Communication",N,Consultant,Consulting,Wall Street Oasis,Consulting,nan,2023-04-01 00:00:00,"WSO user ""Works at Bain""",https://www.wallstreetoasis.com/forum/consulting/year-1-in-consulting-tips-tricks-advice-and-unspoken-rules,Ask sharper questions after an initial pass.
Never 'Reply All' blindly; re-address only those who need the update.,Prevents accidental client exposure of drafts/sensitive context.,Long email chains with mixed client/vendor recipients.,Efficiency,1,2,Observed,warning,"Safety, Communication",N,Consultant,Consulting,Wall Street Oasis,Consulting,nan,2023-04-01 00:00:00,"WSO user ""Works at Bain""",https://www.wallstreetoasis.com/forum/consulting/year-1-in-consulting-tips-tricks-advice-and-unspoken-rules,Double-check recipients when forwarding internal commentary.
"In project intake forms, include 'what happens if this doesn't get done' to force priority thinking.",Surfaces real urgency vs. noise.,Work intake processes,Efficiency,1,4,Anecdotal,Mental Mode,Prioritization/Requirements,Y,Project Coordinator,Operations,,Marketing Tech,,2025-08-01 00:00:00,Workfront Admin Forum,nan,nan
"Own data migration: define source-of-truth, reconciliation reports, and who signs off record-level accuracy before cutover.","SIs configure, but business owns meaning of data; sign-off prevents post go-live chaos.",ERP/CRM implementation data workstreams.,nan,4,4,nan,Guideline,Data Hygiene; Accountability,Y,Data Lead / Business Owner,Data Analysis,nan,HRIS / ERP,nan,2025-08,Workday client lessons (Raven Intel) & Bolt implementation post,https://ravenintel.com/workdayimplementation/,nan
Run joint design workshops with business 'super users' and make them UAT leads; reduces rework and lifts adoption.,Super users become advocates & trainers post go-live.,ERP/CRM process design & testing with SI.,nan,4,4,nan,Pattern,Stakeholder Alignment; Enablement,N,Business Process Owner,Operations / IT,nan,HRIS / Finance,nan,2025-08,Workday – Bolt case; Surety Systems client takeaways,https://blog.workday.com/en-gb/5-valuable-lessons-learned-from-bolts-workday-implementation.html,nan
"Use a GTM positioning statement with fields for [Target Customer] For:, [Need/Opportunity] Who:, [Product Category] is:, [Key Benefit] That:, and [Competitive Alternative] Unlike:",Provides a structured way to define positioning and differentiation across product lines or messaging exercises.,"Marketing, Sales Enablement, GTM Strategy",Clarity,4,4,Observed,Framework,"Positioning, Messaging",Y,CMO,Marketing,CData Software,Software,UNK,2022,William Davis LinkedIn post,https://www.linkedin.com/posts/williamdavis123_messaging-positioning-frameworks-activity-6903478170305792000-Ytj9,Also includes persona mapping logic and guidance on using a structured framework for buyer types in enterprise deals.
"Positioning Statement Framework including Target Customer, Need, Product, Key Benefit, and Competitive Alternative.",Provides a structured approach to differentiate GTM messaging.,"Product launch, Market messaging, GTM content development","Product Marketing, GTM Strategy",5,4,nan,Messaging Template,"Positioning, Product Messaging",N,PMM,Marketing,CData Software,B2B Software,US,2021,William Davis,nan,"Commonly used structure, included in shared screenshot with other frameworks"
Use Western Electric run rules on SPC charts to catch non-random patterns early.,Supplementary rules detect subtle drift before points exceed 3σ limits.,Daily SPC reviews on critical characteristics.,Efficiency,3,3,Observed,Guideline,"Quality Assurance, Testing",N,Quality Engineer,Quality,nan,Automotive/Medical/Electronics,nan,,Wikipedia — Western Electric Rules (reference standard,https://en.wikipedia.org/wiki/Western_Electric_rules,Rules 1–4: 1 beyond 3σ; 2/3 beyond 2σ; 4/5 beyond 1σ; 8 on one side.
"Align creative with lifecycle stage—education for early‑stage users, and urgency/incentives for late‑stage prospects; don’t mix signals.",Stage‑appropriate messaging increases relevance and conversion likelihood by matching mindset.,Lifecycle creative alignment,Revenue,5,4,Observed,pattern,Creative sequencing,N,Creative Strategist,Marketing,UNK,UNK,UNK,2025-04-14,WhatConverts blog,https://www.whatconverts.com/blog/retargeting-ad-examples/,Use education/problem‑aware creatives at TOF; urgency/offer for BOF.
Don't just log error codes — log the *decision path* leading to them,Debugging without context leads to guesswork,Postmortem prep,Safety,3,5,Observed,Guideline,"Logging, Judgment",Y,Dev,Engineering,—,SaaS,—,2025-03-22 00:00:00,What logging saved your ass?,https://news.ycombinator.com/item?id=38815032,Standout comment + 50+ upvotes
Stand up a visible Andon (lights/boards) to surface problems in real time and empower stops.,Visual controls shorten time-to-response and enable long-term fixes.,Manual stations and mixed-model lines.,Efficiency,1,3,Observed,Guideline,"Feedback Loops, Safety",N,Production Supervisor,Operations,nan,General Manufacturing,nan,,Vorne — Andon definition & benefits,https://www.vorne.com/learn/key-concepts/andon/,Pair with clear escalation playbook.
"For recurring card billing, send Account Status Inquiry (ASI) or use Updater before retrying to avoid wasted declines after reissue.",Networks support account updater/ASI to check credential freshness.,Smart retry logic for subscription payments.,Efficiency,1,3,Observed,Guideline,"Planning, Performance Bottlenecks",Y,Billing Ops Lead,Operations,Visa; Mastercard,Financial Services,Global,2024-10-01 00:00:00,Visa/Mastercard Updater programs,https://www.mastercard.us/en-us/business/issuers/products-and-solutions/automatic-billing-updater.html,Reduce issuer soft declines by verifying status first.
"Use dispute reason‑code‑specific templates; e.g., Visa 13.3 'Not As Described' needs refund/return policy evidence, not login/IP.",Mapping evidence to reason code increases win rate and reduces 'insufficient evidence' losses.,Chargeback response assembly at scale.,Revenue,2,4,Observed,Tactical,"Deal Control, Documentation",N,Chargeback Analyst,Operations,Visa; Mastercard,Financial Services,Global,2024-06-01 00:00:00,Visa/Mastercard reason code guides,https://www.mastercard.com/content/dam/mccom/global/documents/chargeback-guide.pdf,Wrong evidence wastes your one CE3.0 attempt for 10.4.
Use Visa VTC (Visa Token Service) or network tokens to maintain authorization continuity through card reissues.,"Network tokens update underlying PAN changes, improving approval and reducing churn.",Recurring/subscription payments continuity.,Revenue,3,3,Observed,Guideline,"Enablement, Productivity",Y,Lifecycle Pm,Product Management,Visa,Financial Services,Global,2024-07-01 00:00:00,Visa Token Service overview,https://usa.visa.com/run-your-business/visa-token-service.html,Pair with Account Updater for PANs not tokenized.
Use 'soft descriptor' fields where supported to show product/site context and reduce recognition disputes.,Network guidance encourages recognizable descriptors to cut friendly fraud.,Lowering 'I don't recognize' chargebacks.,Efficiency,4,4,Observed,Guideline,"Clarity, Communication",N,Payments Pm,Product Management,Visa,Financial Services,Global,2024-06-01 00:00:00,Visa Merchant Guidelines,https://usa.visa.com/dam/VCOM/global/support-legal/documents/merchants-dispute-management-guidelines.pdf,Test how the descriptor renders across issuers.
"In CE 3.0 disputes, include device fingerprint, IP, login, delivery address, and usage logs; missing any required element can void the submission.",Visa's CE 3.0 table defines required combinations—submissions are single‑shot.,CNP fraud (10.4) responses.,Efficiency,1,3,Observed,Tactical,"Documentation, Deal Control",Y,Chargeback Analyst,Operations,Visa,Financial Services,Global,2024-06-01 00:00:00,Visa Dispute Management Guidelines (June 2024,https://usa.visa.com/dam/VCOM/global/support-legal/documents/merchants-dispute-management-guidelines.pdf,Automate data extraction from order systems.
Use Visa's June 2024 dispute guide to target allowable evidence under 10.4 (Card‑Absent).,The guide lists evidence types Visa considers compelling across scenarios.,Assembling dispute packs for CNP fraud claims.,Efficiency,5,3,Observed,Data Source,"Enablement, Documentation",N,Disputes Ops,Operations,Visa,Financial Services,Global,2024-06-01 00:00:00,Visa Dispute Management Guidelines (June 2024,https://usa.visa.com/dam/VCOM/global/support-legal/documents/merchants-dispute-management-guidelines.pdf,Cross‑reference table for CE3.0 evidence elements.
"Map CE 3.0 fields (device ID, IP, login, shipping) into receipts/order records so disputes can be auto‑assembled.",Visa details which evidence qualifies as compelling for CNP fraud disputes.,"Faster, stronger dispute responses for reason code 10.4.",Efficiency,3,3,Observed,Tactical,"Documentation, Enablement",Y,Payments Pm,Product Management,Visa,Financial Services,Global,2024-06-01 00:00:00,Visa Dispute Management Guidelines (June 2024,https://usa.visa.com/dam/VCOM/global/support-legal/documents/merchants-dispute-management-guidelines.pdf,You only get one CE3.0 shot—validate completeness before submission.
Use Visa Secure (3‑D Secure) to shift liability off the merchant when authentication succeeds.,Visa states merchants are protected from certain fraud disputes with 3‑D Secure when processed correctly.,Reducing e‑commerce fraud disputes.,Efficiency,1,3,Observed,Guideline,"Risk, Ghosting Prevention",N,Fraud Analyst,Risk,Visa,Financial Services,Global,2024-06-01 00:00:00,Visa Dispute Management Guidelines (June 2024,https://usa.visa.com/dam/VCOM/global/support-legal/documents/merchants-dispute-management-guidelines.pdf,Check regional liability shift nuances.
Make sure your statement descriptor (DBA + city/state) is recognizable to reduce 'I don't recognize it' disputes.,Visa advises ensuring customers recognize the merchant name on statements.,Lowering friendly‑fraud/recognition disputes.,Efficiency,4,4,Observed,Guideline,"Clarity, Communication",N,Payments Pm,Product Management,Visa,Financial Services,Global,2024-06-01 00:00:00,Visa Dispute Management Guidelines,https://usa.visa.com/dam/VCOM/global/support-legal/documents/merchants-dispute-management-guidelines.pdf,Test live with small purchase to see how it renders.
"In Visa CE3.0, you only get one shot—assemble the VROL pre‑arb with all required data (device ID, IP, etc.).",Visa readiness doc: incorrect/incomplete CE3.0 submissions are declined; single attempt per case.,Preparing a CE3.0 response for 10.4 disputes (CNP fraud).,Efficiency,1,3,Observed,Tactical,"Documentation, Deal Control",Y,Chargeback Analyst,Operations,Visa,Financial Services,Global,2023-03-01 00:00:00,Visa CE3.0 Merchant Readiness,https://usa.visa.com/content/dam/VCOM/regional/na/us/support-legal/documents/compelling-evidence-3.0-merchant-readiness-mar2023.pdf,"Map evidence at order time so it's exportable (login ID, device, IP, shipping)."
"For CE 3.0, include device fingerprint/IP plus at least one other data point for digital goods disputes.",Visa CE tables detail accepted evidence sets for 10.4 disputes.,Preparing chargeback responses for card‑not‑present.,Efficiency,1,3,Observed,Tactical,"Documentation, Dispute Win",Y,Chargeback Analyst,Operations,Visa,Financial Services,Global,2024-10-01 00:00:00,Visa CE 3.0 table (June 2024,https://usa.visa.com/dam/VCOM/global/support-legal/documents/merchants-dispute-management-guidelines.pdf,"See table items 4 & 10 effective Oct 19, 2024."
"Map CE 3.0 evidence fields (e.g., login ID, delivery address) into your receipts for faster dispute assembly.",Visa lists discrete data elements that qualify as compelling evidence.,Building auto‑packaged dispute responses.,Efficiency,3,3,Observed,Tactical,"Documentation, Enablement",Y,Payments Pm,Product Management,Visa,Financial Services,Global,2024-06-01 00:00:00,Visa CE 3.0 table,https://usa.visa.com/dam/VCOM/global/support-legal/documents/merchants-dispute-management-guidelines.pdf,Capture at order time; store securely.
"At the end of user research, record a short video recap for stakeholders.",Makes findings more accessible and engaging.,Post-research synthesis,Efficiency,3,3,Anecdotal,Tactical,Communication/Enablement,N,Research Lead,Design,,Consumer Tech,,2025-08-01 00:00:00,UX Research Ops Guide,nan,nan
"Summarize every user research call with 3 bullets: surprise, concern, confirmation.",Helps capture qualitative signal quickly.,UX research analysis,Efficiency,2,3,Anecdotal,Guideline,Discovery/Feedback Loops,Y,Ux Researcher,Design,,Consumer Tech,,2025-08-01 00:00:00,UX research blog,nan,nan
"Use the '0, 1, 3' rule in UI design: default to zero clicks, one field, or three choices.",Keeps flows fast and intuitive.,Product UX reviews,Efficiency,2,3,Anecdotal,Guideline,Feature Design/Enablement,Y,Product Designer,Product Management,,Tech,,2025-08-01 00:00:00,UX heuristic library,nan,nan
Use 'lo-fi demos' (hand-drawn or figma wireframes) early to validate direction fast.,Reduces rework before dev begins.,Product discovery,Efficiency,1,3,Anecdotal,Tactical,Feature Design/Feedback Loops,Y,Ux Designer,Design,,Consumer Tech,,2025-08-01 00:00:00,UX Collective,nan,nan
"Use the 'two tabs rule' when designing onboarding: if users need more than two tabs to complete a task, simplify.",Keeps early UX friction low.,New user experience design,Retention,1,4,Anecdotal,Guideline,Enablement/Feature Design,Y,Product Designer,Product Management,,SaaS,,2025-08-01 00:00:00,UX case study,nan,nan
Make the ad headline and landing-page H1 identical; keep visuals and CTA consistent from ad → email → landing → thank-you to preserve 'conversion scent'.,"Consistency reassures visitors they’re in the right place, reduces cognitive load, increases relevancy/quality, and lifts conversions.",Message match across paid ads and landing pages,Revenue,5,5,Observed,rule-of-thumb,Message match,N,Performance Marketer,Marketing,UNK,UNK,UNK,2021-11-23,Unbounce (Chin Tan; Ryan Watson); KlientBoost,https://unbounce.com/landing-page-examples/high-converting-landing-pages/,See Later example (email+ad+LP alignment) and onX example; keep the same headline; use dynamic text if needed.
Maintain conversion scent end‑to‑end: ad → email → pre‑LP creative → landing page—with the same offer and visual cues.,Cross‑channel consistency prevents confusion and drop‑off while reinforcing the brand promise.,Cross‑channel campaign consistency,Revenue,5,4,Observed,rule-of-thumb,Message match,N,Brand Strategist,Marketing,Later,Social Media SaaS,UNK,2021-11-23,"Unbounce (Chin Tan, Later)",https://unbounce.com/landing-page-examples/high-converting-landing-pages/,Keep TOF forms short; the ask should match the value of the offer.
Create a separate mobile landing experience (lighter assets) while keeping the brand look identical to desktop; optimize mobile-first.,"Mobile-first load speed and clarity reduce drop-offs while preserving brand cues, improving conversions on mobile traffic.",Mobile landing optimization,Revenue,5,3,Observed,pattern,Mobile optimization,N,Growth Marketer,Marketing,Twillory (via WITHIN),Apparel,UNK,2021-11-23,"Unbounce (Aditya Bagri, WITHIN)",https://unbounce.com/landing-page-examples/high-converting-landing-pages/,Keep creative consistent; use a lighter mobile variant to maintain speed without losing brand cues.
"Define telemetry minimums for new features (key events, timing, errors) before coding starts.",Instrumentation retrofits rarely happen; define what 'good' looks like up front.,Feature delivery; growth experiments.,Enablement,5,4,Observed,Guideline,"Clarity, Accountability",Y,PM,Product Development,—,Software,—,2023-04-09 00:00:00,ultralytics,https://github.com/ultralytics/ultralytics/issues/1915,Representative source for rule: telemetry_minimums
Prefer ULID over UUID v4 when sortability matters,"Lexicographically sortable, 128-bit, base32 Crockford.",Keep inserts mostly time-ordered and human-usable,Efficiency,1,3,Observed,Guideline,"Performance Bottlenecks, Data Hygiene",N,Enterprise Architect,IT,nan,Data,nan,2025-08-01 00:00:00,ULID Spec (GitHub,https://github.com/ulid/spec,nan
"In stakeholder reviews, focus on what a few key data points mean—not the wall of data.",Senior planners screen for ability to translate data to decision guidance.,Junior strategist presenting a POV to hiring manager or client.,Efficiency,1,4,Observed,cue,"Translation, Communication",N,Associate Planning Director,Advertising Strategy,Reddit,Advertising,nan,,u/Princenomad (Assoc. Planning Director,https://www.reddit.com/r/advertising/comments/s7rm8n/if_youre_into_strategyplanning_how_did_you_get/,Be able to conversationally talk about what the data means for the project.'
Most responsible person decides' and others disagree‑and‑commit.,Ownership concentrates decision rights with the person whose outcome is on the line.,When consensus stalls and timelines slip.,Efficiency,2,3,Observed,Mental Mode,"Accountability, Escalation",N,Staff Engineer,Engineering,Reddit,Software,nan,2025-06-01 00:00:00,u/lord_braleigh,https://www.reddit.com/r/ExperiencedDevs/comments/1lioce6/how_to_handle_an_engineer_who_prefers_hacks_vs/,A management pattern echoed by multiple replies.
"Require a short design doc + effort estimate from each approach; in parallel, ship a quick POC with the off‑the‑shelf tool.",Side‑by‑side artifacts make decision criteria explicit and unblock stalemates.,Tech stack dispute resolution.,Efficiency,1,3,Observed,Tactical,"Deal Control, Escalation",Y,Senior Engineer,Engineering,Reddit,Software,nan,2025-06-01 00:00:00,u/light-triad; u/Antique-Stand-4920; u/mmcnl,https://www.reddit.com/r/ExperiencedDevs/comments/1lioce6/how_to_handle_an_engineer_who_prefers_hacks_vs/,Follow with a decision doc weighing pros/cons vs. requirements.
"Write requirements as measurable bullets (e.g., GB/day throughput, SQL‑expressible transforms, horizontal scaling, scheduling, observability).",Concrete requirements depersonalize the debate and frame solution trade‑offs.,Choosing between custom code vs. standard ETL/ELT tools.,Efficiency,1,3,Observed,Guideline,"Requirements, Clarity",Y,Senior Engineer,Engineering,Reddit,Software,nan,2025-06-01 00:00:00,u/light-triad (top reply,https://www.reddit.com/r/ExperiencedDevs/comments/1lioce6/how_to_handle_an_engineer_who_prefers_hacks_vs/,Use the same bullets to evaluate designs and POCs.
Protect creative focus: route account feedback through strategy/CD—don't let accounts work creators directly.,Maintains clarity of brief and prevents politics from derailing creative work.,Agency client feedback cycles.,Efficiency,1,3,Observed,Guideline,"Deal Control, Internal Politics",Y,Planner,Advertising Strategy,Reddit,Advertising,nan,,u/JeffryRelatedIssue,https://www.reddit.com/r/advertising/comments/s7rm8n/if_youre_into_strategyplanning_how_did_you_get/,Advice given to rookies entering planning teams.
Define DoD for 'the strategy' up front: a 1‑page exec summary + a research/readout deck with next‑step recs.,Clients often want a simple 'strategy artifact'; pre‑agreeing format reduces swirl.,Kickoff with stakeholders who ask for 'a strategy on paper'.,Efficiency,1,4,Observed,Guideline,"Scoping, Executive Alignment",Y,Strategist,Marketing,Reddit,Marketing,nan,2025-01-01 00:00:00,u/Intelligent_Place625,https://www.reddit.com/r/marketing/comments/1icj79m/what_are_your_strategy_hacks/,Thread also notes that one‑pagers beat 50‑slide decks for clarity.
"Structure strategy docs with OGSM (Objectives, Goals, Strategies, Measures) to separate 'what/why' from 'how'.",OGSM keeps strategy distinct from tactics and makes review criteria explicit.,Writing a marketing strategy one‑pager for execs.,Efficiency,3,3,Observed,Tactical,"Clarity, Documentation",N,Strategist,Marketing,Reddit,Marketing,nan,2025-01-01 00:00:00,u/BigRedTone (top reply,https://www.reddit.com/r/marketing/comments/1icj79m/what_are_your_strategy_hacks/,Example in thread uses CRO goals and staged measures.
Prefer ELT over ETL when your stack supports it.,Keeping raw data intact simplifies debugging and scaling compute in‑warehouse.,Designing first‑gen pipelines on modern warehouses.,Efficiency,4,3,Observed,Guideline,"Data Hygiene, Testing",N,Data Engineer,Engineering,Reddit,Software,nan,2025-06-01 00:00:00,u/angrathias (+ reply thread,https://www.reddit.com/r/ExperiencedDevs/comments/1lioce6/how_to_handle_an_engineer_who_prefers_hacks_vs/,Qualification: only when your ELT platform is the system of record.
"Budget operational metrics into the choice: current jobs, GB/runtime now and at growth, build time per new job, MTTR with/without observability.",Opex comparisons expose hidden costs of 'quick hacks'.,Business case for platform vs. bespoke.,Efficiency,1,3,Observed,Guideline,"Forecasting, Performance Bottlenecks",Y,Data Engineering Manager,Engineering,Reddit,Software,nan,2025-06-01 00:00:00,u/absinthe718,https://www.reddit.com/r/ExperiencedDevs/comments/1lioce6/how_to_handle_an_engineer_who_prefers_hacks_vs/,Use these as budgeting inputs and decision criteria.
Use plain .md files and YAML front matter to structure a personal knowledge base that's natively readable by AI tools.,"Markdown avoids formatting issues and proprietary systems, allowing AI to process and retrieve structured information more accurately and flexibly.",Personal knowledge management for AI assistants,Efficiency,5,5,Peer-validated,workaround,Documentation,N,CTO / Knowledge Worker,General,General,Tech / AI / Creator Economy,US,2025-08-15 00:00:00,Tyler Folkman (LinkedIn Post,https://www.linkedin.com/posts/tylerfolkman_markdown-ai-productivity-activity-7100000000000000000,Recommended apps: iA Writer + Working Copy + GitHub. YAML helps structure data at the top of markdown for improved parsing.
