description,rationale,use_case,impact_area,transferability_score,actionability_rating,evidence_strength,type_(form),tag_(application),unique?,role,function,company,industry,country,date,source_(interview_#_/_name),link,notes
Pre-wire high-stakes meetings: brief key stakeholders 1:1 so there are no surprises in the room.,"Builds alignment, surfaces objections early, and avoids derailing outcomes live.",C-suite status/go-no-go reviews; funding asks.,Efficiency,2,3,Observed,Tactical,"Executive Alignment, Stakeholder Alignment",N,Project/Program Manager (Commenter),Product Management,nan,nan,nan,2024-01-01 00:00:00,"Reddit | u/bwong00 — r/projectmanagement: ""How to facilitate high-stress c-suite project status meeting?""",https://www.reddit.com/r/projectmanagement/comments/1af17v2/how_to_facilitate_highstress_csuite_project/,Includes Manager-Tools reference on pre-wiring.
"For tiny UI tweaks, skip A/B; ship and do time-vs-time monitoring with guardrails.",Avoids spending weeks to detect trivial effects; keeps momentum high.,Low-stakes UI/copy changes under delivery pressure.,Efficiency,1,3,Observed,Guideline,"Risk Triage, Testing",Y,Product/Experimentation Practitioners (Commenters),Product Management,nan,nan,nan,2024-10-01 00:00:00,Reddit | u/brottochstraff (with agreement by u/w0wlife) — comments in A/B Crash Course thread,https://www.reddit.com/r/ProductManagement/comments/1g0pe04/crash_course_on_ab_testing_for_product_managers/,Reserve A/B for uncertain/high-impact changes.
"In beta, define success in stakeholder terms and add one measurable signal to answer it automatically.",Beta success = solving the stakeholder's job; instrumentation must capture that outcome.,Closed beta evaluations.,Efficiency,1,3,Observed,Guideline,Quality Assurance; Discovery,Y,Pm (Commenter),Product Management,nan,Any,nan,,"Reddit | u/beta-metrics — ""What metrics to track during Beta Testing""",https://www.reddit.com/r/ProductManagement/comments/mwl6zq/what_metrics_to_track_for_a_product_during_beta/,nan
"Ship an OpenAPI spec, Postman collection, and runnable sandbox as part of API docs.",Hands-on artifacts cut time-to-first-call and reduce support tickets.,Developer Experience for 3rd-party integrators.,Efficiency,1,3,Observed,Guideline,Enablement; Documentation,N,Pm/Devrel (Commenter),Product Management,nan,APIs,nan,,"Reddit | u/asterisk_works — ""Anyone work for API product companies?""",https://www.reddit.com/r/ProductManagement/comments/vn9wq7/anyone_work_for_api_product_companies/,nan
"When deprecating in-product, prefer removal over leaving a deprecated UI ghost that links to web search.",Dead surfaces confuse users and erode trust; removal plus comms is cleaner.,"Handling deprecated features in UI (e.g., Outlook search).",Efficiency,3,2,Observed,warning,"Quality Assurance, Clarity",Y,Customer/Practitioner (Op),Product Management,nan,Productivity software,nan,2024-12-01 00:00:00,Reddit | u/assortedhandles — Microsoft deprecation thread,https://www.reddit.com/r/ProductManagement/comments/1j353vt/pms_of_microsoft_why_dont_you_remove_deprecated/,Critiques leaving deprecated panel with broken links.
"For APIs, clarify doc ownership (PM vs Tech Writer vs Eng) and contribute examples as the PM.",Clear ownership and PM-supplied examples reduce integrator confusion and support tickets.,Developer experience improvements for APIs.,Efficiency,5,4,Observed,Guideline,"Enablement, Documentation",N,Api Product Manager (Op),Product Management,nan,APIs,nan,,"Reddit | u/apiPM_new — ""API Product Managers: Who owns developer documentation?""",https://www.reddit.com/r/ProductManagement/comments/1j9ee0e/api_product_managers_who_owns_developer/,Thread consensus: shared responsibility with PM providing examples.
Use fake-door tests sparingly; overuse erodes trust (especially for small brands).,Deceptive prompts can damage credibility and long-term retention.,Validating demand for net-new features.,Retention,1,2,Observed,warning,Safety; Communication,N,Pm (Op),Product Management,nan,SaaS,nan,2024-12-01 00:00:00,"Reddit | u/amohakam — ""Everyone has an idea for the PM…""",https://www.reddit.com/r/ProductManagement/comments/1iii59m/everyone_has_an_idea_for_the_product_manager_they/,Explicit critique of fake-door misuse.
"When stakeholders demand certainty, reframe to static goals/problems rather than feature lists.",Shifts debate from 'what feature when' to 'what outcome first'.,Resetting expectations in long dev cycles.,Efficiency,2,3,Observed,Mental Mode,"Stakeholder Alignment, Communication",Y,Product Manager (Commenter),Product Management,nan,nan,nan,,Reddit | u/AmericanSpirit4 — dealing with senior stakeholders thread,https://www.reddit.com/r/ProductManagement/comments/1jwozc0/how_do_you_guys_deal_with_senior_stakeholders/,Prompts to discuss goals/outcomes vs features.
"When PRDs are used, include unhappy paths, key NFRs (e.g., response time), and a testing plan with acceptance criteria.",Prevents blind spots that cause rework and production issues.,Specs for medium-complexity features in mature orgs.,Efficiency,1,3,Observed,Guideline,"Quality Assurance, Requirements",N,Product Manager (Author),Product Management,nan,nan,nan,2021-06-01 00:00:00,"Reddit | u/AlwaysAPM — ""How to write a product requirements document""",https://www.reddit.com/r/ProductManagement/comments/nh700w/how_to_write_a_product_requirements_document/,Post provides a concrete section list and examples for PRDs.
"Define success, guardrail, and tracking metrics separately before testing.",Different metric classes serve different purposes; clarity reduces p-hacking.,Designing A/B tests and interview responses.,Efficiency,4,3,Observed,Guideline,"Testing, Quality Assurance",N,Data Scientist (Author),Product Management,nan,nan,nan,2024-10-01 00:00:00,"Reddit | u/akshatds — ""A/B test interview guide""",https://www.reddit.com/r/datascience/comments/1fyrawz/a_guide_to_passing_the_ab_test_interview_question/,Advises 2–4 guardrails you don't want to harm.
15-min discovery spine: Why us? Why now? Why do anything?,3 Whys as discovery backbone; use silence to elicit detail.,Drive crisp technical discovery before demo,Efficiency,1,3,Observed,Tactical,"Discovery, Clarity",Y,Sales Engineer,Sales Engineering,nan,Software,nan,2025-08-01 00:00:00,Reddit | top-level answer,https://www.reddit.com/r/salesengineers/comments/15izhp5/questions_to_ask_during_discovery/,nan
Go wide in the account—build multi-thread relationships to validate progress,Ask directly; validate with multiple stakeholders.,Reduce single-thread risk in long cycles,Efficiency,1,4,Observed,pattern,Stakeholder Alignment; Relationship Building,Y,Ae,Sales,nan,Enterprise (assumed),nan,2025-08-01 00:00:00,Reddit | top thread consensus,https://www.reddit.com/r/sales/comments/190a027/people_with_6_months_sales_cycle_how_do_you_know/,nan
Define PoC/PoV as short deployment proving specific use cases with documented criteria & signed next steps,Document criteria; get sign-off + agreed next steps.,Increase conversion from PoC to purchase,Efficiency,1,4,Observed,Guideline,Testing; Requirements,Y,Sales Engineer,Sales Engineering,nan,SaaS,nan,2025-08-01 00:00:00,Reddit | top SE thread,https://www.reddit.com/r/salesengineers/comments/1gurxft/what_does_poc_mean_to_you/,nan
Open demos by clarifying agenda/time; park deep questions until proper context,Control narrative up front; 'parking lot' for deep dives.,Prevent derailed demos; keep narrative tight,Efficiency,1,3,Observed,Guideline,Facilitation; Deal Control,Y,Sales Engineer,Sales Engineering,nan,Software,nan,2025-08-01 00:00:00,Reddit | top comment (thread,https://www.reddit.com/r/salesengineers/comments/1dyhw1w/how_do_you_handle_excessive_questions_during_demo/,nan
"If you must extend a deadline, ask for an extra give (e.g., reference)",Quid-pro-quo for any post-deadline concession.,Maintain leverage when granting exceptions,Efficiency,1,4,Observed,Tactical,Negotiation; Incentives,Y,Ae,Sales,nan,nan,nan,2025-08-01 00:00:00,Reddit | Too_Many_Mind_,https://www.reddit.com/r/sales/comments/a7xqjk/please_dont_extend_end_of_year_discounts/,nan
Clarify that price holds tied to this-quarter booking don't carry to next quarter,"""I can't get it booked next week; discount applies only this quarter.""",Set expectations on rev-rec constraints,Revenue,1,3,Observed,Guideline,Negotiation; Deal Control,N,Ae,Sales,nan,nan,nan,2025-08-01 00:00:00,Reddit | throwingit_all_away,https://www.reddit.com/r/sales/comments/a7xqjk/please_dont_extend_end_of_year_discounts/,nan
End follow-ups with 'Where would you like to go from here?',Comment: almost always draws a reply.,Get an explicit status update from a non-responder,Efficiency,1,3,Observed,Tactical,Clarity; Communication,Y,Ae (Assumed),Sales,nan,nan,nan,2025-08-01 00:00:00,Reddit | The_Snozzberries,https://www.reddit.com/r/sales/comments/yotund/10_tactics_to_reengage_that_prospect_who_is/,nan
Create urgency by building a Mutual Action Plan (MAP) that works back from go-live,Work backwards; show impact of delays on go-live.,Make timelines concrete and co-owned,Efficiency,1,3,Observed,Guideline,Planning; Executive Alignment,Y,Ae,Sales,nan,SaaS (assumed),nan,2025-08-01 00:00:00,Reddit | Techn1que,https://www.reddit.com/r/sales/comments/17qh3oo/creating_urgency_is_utter_bullsht/,nan
"Use 'cost of inaction' explicitly; if they don't care, nothing works",Make inaction's cost explicit; otherwise accept the 'no priority'.,Frame real business impact to justify priority,Efficiency,1,4,Observed,Mental Model,Clarity; Strategic Planning,Y,Ae,Sales,nan,nan,nan,2025-08-01 00:00:00,Reddit | Techn1que,https://www.reddit.com/r/sales/comments/17qh3oo/creating_urgency_is_utter_bullsht/,nan
Treat procurement as a partner; show how you satisfy their mandate,"Map your offer to their goals: compliance, consolidation, price, governance.",Smoother contracting and fewer escalations,Risk,1,3,Observed,Guideline,Negotiation; Stakeholder Alignment,Y,Ae,Sales,nan,nan,nan,2025-08-01 00:00:00,Reddit | seductus,https://www.reddit.com/r/sales/comments/c0boia/dealing_with_procurement/,nan
Use MAP engagement (views/access) to test champion strength and deal health,MAP tools show what buyers actually review and when.,Qualify champions and spot slippage early,Efficiency,1,4,Observed,pattern,Pattern Recognition; Deal Control,Y,Ae,Sales,nan,nan,nan,2025-08-01 00:00:00,Reddit | Sea-Reference620 / Sushiibandit,https://www.reddit.com/r/sales/comments/11gz270/mutual_action_plans_suck/,nan
"If cell goes unanswered, call the main office and ask to be redirected",Often surfaces the real objection when routed.,Reach a ghosting prospect via their office line,Efficiency,1,4,Observed,Tactical,Workaround; Ghosting Prevention,Y,Ae (Assumed),Sales,nan,nan,nan,2025-08-01 00:00:00,Reddit | rivenjg,https://www.reddit.com/r/sales/comments/yotund/10_tactics_to_reengage_that_prospect_who_is/,nan
Always book the next meeting and confirm process before ending current call,"Have a time booked, then ask for commitment.",Prevent drop-offs between meetings,Efficiency,1,4,Observed,Guideline,Accountability; Planning,Y,Ae,Sales,nan,nan,nan,2025-08-01 00:00:00,Reddit | RememberDaClowns2016,https://www.reddit.com/r/sales/comments/o2ldmw/establishing_clear_next_steps_in_sales/,nan
When you must run a trial: define success criteria; limit to 3–5 business days; set check-ins,Qualify + criteria + short window + day-by-day check-ins.,Avoid zombie trials and create urgency,Efficiency,1,3,Observed,Guideline,Testing; Deal Control,Y,Ae,Sales,nan,SaaS,nan,2025-08-01 00:00:00,Reddit | ready_4_the_mayans,https://www.reddit.com/r/sales/comments/ut52p8/tips_on_how_to_say_no_to_a_free_saas_trial/,nan
Don't custom-build a full ERP/MRP; use commercial systems—one developer can't replicate planning modules.,"MRP, scheduling, financials, and integrations are too complex to recreate reliably.",Leadership pushing an internal ERP as a 'quick win'.,Efficiency,3,2,Observed,warning,"Risk Triage, Planning",N,Systems Admin,Operations,nan,Manufacturing IT,nan,2025-02-01 00:00:00,"Reddit | r/sysadmin — ""Our ERP programmer is a disaster…""",https://www.reddit.com/r/sysadmin/comments/1il4ebg/our_erp_programmer_is_a_disaster_and_my_boss/,Experienced take: custom ERP is unrealistic beyond simple CRM/inventory.
Use two-bin Kanban math: set total cards ~2× average consumption between replenishments; place reorder at halfway.,Simple rule keeps service level without complex MRP for small parts.,Point-of-use fasteners/consumables.,Efficiency,1,3,Observed,Tactical,"Planning, Resource Management",Y,Materials Planner,Supply Chain,nan,Any,nan,,"Reddit | r/supplychain — ""Kanban cards"" (rule of thumb",https://www.reddit.com/r/supplychain/comments/11l10up/kanban_cards/,Comment describes doubling and second card at halfway.
Cancel meetings without a purpose or agenda; send update email instead,"Meetings are for decisions, not info dumps.",Weekly team/status meetings,Efficiency,3,3,Observed,Guideline,Time Management,N,Consultant,Consulting,nan,Any,nan,2025-08-01 00:00:00,Reddit | r/smallbusiness – meeting best practices,https://www.reddit.com/r/smallbusiness/comments/taxwqk/what_are_your_best_practices_for_running_an/,nan
Bring a 'safe offline' demo deck or MP4 in case SSO/VPN blocks screen control,"When screen control or SSO fails, switch to short video proof points.",Keep momentum when conferencing tools or security policies fail,Efficiency,2,3,Observed,Tactical,"Testing, Risk",Y,Sales Engineer,Sales Engineering,nan,Enterprise,nan,2025-08-01 00:00:00,Reddit | r/salesengineers war stories,https://www.reddit.com/r/salesengineers/,nan
Start demos with clear agenda/timeboxing; park deep dives in a 'parking lot',Clarify agenda + time; park deep Qs to return later.,Prevent derailed demos and keep narrative tight,Efficiency,1,3,Observed,Guideline,"Facilitation, Deal Control",Y,Sales Engineer,Sales Engineering,nan,Software,nan,2025-08-01 00:00:00,Reddit | r/salesengineers thread,https://www.reddit.com/r/salesengineers/comments/1dyhw1w/how_do_you_handle_excessive_questions_during_demo/,nan
Use a dedicated sandbox tenant with fixed seed data; reset before every demo,Script a reset; keep sample records realistic for the target vertical.,Avoid stale data and permissions drift breaking the flow,Efficiency,5,4,Observed,Guideline,"Quality Assurance, Data Hygiene",Y,Sales Engineer,Sales Engineering,nan,SaaS,nan,2025-08-01 00:00:00,Reddit | r/salesengineers setup threads,https://www.reddit.com/r/salesengineers/,nan
Disable desktop notifications and set Do Not Disturb before screen-sharing,Turn off notifications; declutter; zoom 125%; hide bookmarks.,Avoid distracting pop-ups and confidentiality leaks,Efficiency,1,3,Observed,Tactical,"Quality Assurance, Facilitation",Y,Sales Engineer,Sales Engineering,nan,SaaS,nan,2025-08-01 00:00:00,Reddit | r/salesengineers hygiene,https://www.reddit.com/r/salesengineers/,nan
Keep a pre-recorded 90-second fallback clip for risky live steps,Short MP4 clip for the one risky step if live system stalls.,Protect demos against flaky network or environments,Risk,2,4,Observed,Tactical,"Testing, Risk",Y,Sales Engineer,Sales Engineering,nan,SaaS,nan,2025-08-01 00:00:00,Reddit | r/salesengineers hygiene,https://www.reddit.com/r/salesengineers/,nan
"Use a demo checklist: env reset, seed data, auth tokens valid, feature flags correct",Pre-flight avoids 'works on my machine' moments.,Reduce demo surprises from stale envs,Efficiency,5,4,Observed,Guideline,"Quality Assurance, Data Hygiene",Y,Sales Engineer,Sales Engineering,nan,SaaS,nan,2025-08-01 00:00:00,Reddit | r/salesengineers checklists,https://www.reddit.com/r/salesengineers/,nan
Offer to co-author a one-page Business Case with their champion,"Problem, current cost, future state, risks, timeline, owners.",Arm the champion to sell internally,Risk,1,3,Observed,Guideline,"Executive Alignment, Documentation",Y,Sales Engineer,Sales Engineering,nan,SaaS,nan,2025-08-01 00:00:00,Reddit | r/salesengineers + r/sales,https://www.reddit.com/r/salesengineers/,nan
Ask for a data sample early (CSV/JSON) to validate field availability and quality,Early profiling prevents PoC stalls due to missing keys.,Avoid surprises when mapping integrations,Efficiency,1,3,Observed,Tactical,"Data Hygiene, Discovery",Y,Sales Engineer,Sales Engineering,nan,SaaS,nan,2025-08-01 00:00:00,Reddit | r/salesengineers,https://www.reddit.com/r/salesengineers/,nan
Bring a pre-written 'exec summary' email you can send in 2 minutes post-call,"Template: pains heard, proof shown, agreed next step, owners, dates.",Lock in commitments and who-owns-what while fresh,Efficiency,5,4,Observed,Tactical,"Documentation, Accountability",Y,Sales Engineer,Sales Engineering,nan,SaaS,nan,2025-08-01 00:00:00,Reddit | r/salesengineers,https://www.reddit.com/r/salesengineers/,nan
"Confirm environment parity: demo ≈ what the buyer will get (versions, flags)",nan,Avoid credibility hits when PoC differs from prod,Efficiency,3,3,Anecdotal,Guideline,"Quality Assurance, Clarity",Y,Sales Engineer,Sales Engineering,nan,SaaS,nan,2025-08-01 00:00:00,Reddit | r/salesengineers,nan,nan
Define PoC exit criteria in writing and get buyer sign-off before starting,Signed criteria + success owner + timebox are prerequisites.,Prevent scope creep and 'eternal PoCs',Efficiency,1,3,Observed,Guideline,"Accountability, Testing",Y,Sales Engineer,Sales Engineering,nan,SaaS,nan,2025-08-01 00:00:00,Reddit | r/salesengineers,https://www.reddit.com/r/salesengineers/,nan
End every demo with a 90-second recap and a one-click calendar link for next steps,Use Calendly/HubSpot link; ask for decision process confirmation.,Turn interest into scheduled action while energy is high,Efficiency,1,4,Observed,Tactical,"Accountability, Clarity",Y,Sales Engineer,Sales Engineering,nan,SaaS,nan,2025-08-01 00:00:00,Reddit | r/salesengineers,https://www.reddit.com/r/salesengineers/,nan
"For browser-based demos, pre-warm tabs and disable auto-update banners",Kill extensions that add overlays; set a clean profile.,Reduce lag and UI surprises on live calls,Efficiency,1,3,Observed,Tactical,"Quality Assurance, Facilitation",N,Sales Engineer,Sales Engineering,nan,SaaS,nan,2025-08-01 00:00:00,Reddit | r/salesengineers,https://www.reddit.com/r/salesengineers/,nan
Have an 'Oops Path' slide ready—what happens if a step fails?,"Demo the error UX briefly: retries, rollbacks, support path.",Show maturity by acknowledging failure handling,Efficiency,1,4,Observed,Tactical,"Facilitation, Safety",N,Sales Engineer,Sales Engineering,nan,Enterprise,nan,2025-08-01 00:00:00,Reddit | r/salesengineers,https://www.reddit.com/r/salesengineers/,nan
"If a question requires deep dive, book a follow-up with the right SME",Parking-lot then schedule SME follow-up.,Maintain flow and bring the right expertise,Efficiency,1,4,Observed,Guideline,"Escalation, Team Dynamics",Y,Sales Engineer,Sales Engineering,nan,SaaS,nan,2025-08-01 00:00:00,Reddit | r/salesengineers,https://www.reddit.com/r/salesengineers/,nan
"If buyer requests 'just a quick generic demo', insist on 3 pains first or reschedule",Generic tours rarely convert; get 3 pains or reset the call.,"Avoid low-probability, unfocused demos",Efficiency,1,4,Observed,warning,"Scoping, Requirements",Y,Sales Engineer,Sales Engineering,nan,SaaS,nan,2025-08-01 00:00:00,Reddit | r/salesengineers,https://www.reddit.com/r/salesengineers/,nan
"Keep a one-page integration map showing auth, data flow, events, and error paths",Picture > words; include retry/backoff and failure handling.,Give execs and architects a single artifact to react to,Efficiency,1,3,Observed,Guideline,"Documentation, Communication",Y,Sales Engineer,Sales Engineering,nan,SaaS,nan,2025-08-01 00:00:00,Reddit | r/salesengineers,https://www.reddit.com/r/salesengineers/,nan
"Pin a short mutual agenda in the calendar invite: Objectives, Roles, Success Criteria",People read the invite; it sets boundaries for what the meeting is (and isn't).,Pre-wire expectations and avoid mid-call resets,Efficiency,2,3,Observed,Guideline,"Planning, Accountability",N,Sales Engineer,Sales Engineering,nan,SaaS,nan,2025-08-01 00:00:00,Reddit | r/salesengineers,https://www.reddit.com/r/salesengineers/,nan
Pre-agree a demo agenda in the calendar invite; include objectives and roles,"Calendar invite carries scope, objectives, roles.",Avoid surprises and keep meetings tight,Efficiency,1,3,Observed,Tactical,"Facilitation, Planning",Y,Sales Engineer,Sales Engineering,nan,SaaS,nan,2025-08-01 00:00:00,Reddit | r/salesengineers,https://www.reddit.com/r/salesengineers/,nan
Run dry-runs with a colleague who plays the 'interrupter' role,Practice reset phrases and steering back to agenda.,Build muscle memory for regaining control after interruptions,Efficiency,1,3,Observed,Guideline,"Team Dynamics, Testing",N,Sales Engineer,Sales Engineering,nan,SaaS,nan,2025-08-01 00:00:00,Reddit | r/salesengineers,https://www.reddit.com/r/salesengineers/,nan
Schedule security questionnaires/DPAs in the MAP to avoid end-game delays,Make security artifacts first-class milestones.,Move infosec reviews earlier in the cycle,Risk,3,3,Observed,Tactical,"Planning, Documentation",Y,Sales Engineer,Sales Engineering,nan,SaaS,nan,2025-08-01 00:00:00,Reddit | r/salesengineers,https://www.reddit.com/r/salesengineers/,nan
Session-record and chapter-mark the demo before sharing broadly,"Chapters: discovery highlights, 3 proofs, objections, next steps.","Give busy SMEs the 90 seconds they need, not 45 minutes",Efficiency,1,4,Observed,Guideline,"Collaboration, Time Management",N,Sales Engineer,Sales Engineering,nan,SaaS,nan,2025-08-01 00:00:00,Reddit | r/salesengineers,https://www.reddit.com/r/salesengineers/,nan
Show 'admin break-glass' flows only if asked; buyers fear accidental risk,Don't demo dangerous toggles unless a security stakeholder requests it.,Avoid triggering security concerns mid-demo,Risk,1,4,Observed,warning,"Safety, Internal Politics",N,Sales Engineer,Sales Engineering,nan,SaaS,nan,2025-08-01 00:00:00,Reddit | r/salesengineers,https://www.reddit.com/r/salesengineers/,nan
Use 'reverse demo' for discovery-heavy orgs—have the buyer share their screen first,They narrate process; you mirror with targeted paths only.,Expose true workflows and data constraints before showing anything,Efficiency,1,3,Observed,Guideline,"Discovery, Facilitation",Y,Sales Engineer,Sales Engineering,nan,Enterprise,nan,2025-08-01 00:00:00,Reddit | r/salesengineers,https://www.reddit.com/r/salesengineers/,nan
Use a 'parking lot' doc link in chat so deferred questions aren't lost,Drop a shared doc link; capture owner and due date live.,Defer deep dives without losing commitments,Efficiency,1,3,Observed,Tactical,"Documentation, Facilitation",Y,Sales Engineer,Sales Engineering,nan,SaaS,nan,2025-08-01 00:00:00,Reddit | r/salesengineers,https://www.reddit.com/r/salesengineers/,nan
"Use a 'reverse demo'—prospect narrates process first, then show matching paths",Buyer drives; you show the path that fits.,Maximize relevance and reduce fatigue,Efficiency,1,4,Observed,Guideline,"Discovery, Scoping",Y,Sales Engineer,Sales Engineering,nan,SaaS,nan,2025-08-01 00:00:00,Reddit | r/salesengineers,https://www.reddit.com/r/salesengineers/,nan
Whiteboard the 'target day-in-the-life' before any screenshare,Sketch the flow; then show the critical path only.,Align on desired workflow; eliminate irrelevant demo paths,Efficiency,1,4,Observed,Guideline,"Facilitation, Planning",Y,Sales Engineer,Sales Engineering,nan,SaaS,nan,2025-08-01 00:00:00,Reddit | r/salesengineers,https://www.reddit.com/r/salesengineers/,nan
Cap generic demos at ≤30 minutes; show 3 things that map to pain,Better three targeted wins than a 60-min sweep.,Avoid feature tours; focus on pain-resolution,Efficiency,1,3,Observed,Guideline,"Scoping, Requirements",Y,Sales Engineer,Sales Engineering,nan,Software,nan,2025-08-01 00:00:00,Reddit | r/sales thread,https://www.reddit.com/r/sales/comments/ca71u8/why_dont_salespeople_know_how_to_demo_software/,nan
Use in-app guides sparingly and time-based nudges for users who stall before key actions (48h).,Behavior-triggered nudges outperform generic drip campaigns for activation.,Self-serve activation sequences.,Efficiency,1,3,Observed,Guideline,Productivity; Enablement,N,Founder/Pm (Commenters),Product Management,nan,SaaS,nan,2025-08-01 00:00:00,Reddit | r/SaaS activation advice thread,https://www.reddit.com/r/SaaS/comments/1lv7wcw/seeking_advice_on_scaling_subscriptions_for_our/,Specific 48h follow-up window suggested.
"When raising prices, grandfather existing customers where possible; communicate early and often.",Reduces churn risk and backlash during pricing transitions.,Pricing/packaging changes on existing plans.,Risk,1,3,Observed,Guideline,Incentives; Communication,N,Founders/Pms (Commenters),Product Management,nan,SaaS,nan,,Reddit | r/SaaS + r/startups threads on grandfathering,https://www.reddit.com/r/SaaS/comments/1andect/price_increase_how_to_handle/,nan
"Book SteerCo invites with objectives, decisions needed, and pre-read link",Decision-centric agendas keep execs engaged.,Quarterly or monthly SteerCo meetings,Efficiency,5,3,Observed,Tactical,Planning,N,Engagement Manager,Consulting,nan,Any,nan,2025-08-01 00:00:00,Reddit | r/projectmanagement – SteerCo invite best practices,https://www.reddit.com/r/projectmanagement/comments/yhlesi/steering_committee_invitation/,nan
"Status emails: 5 bullets max—progress, risks, decisions, next steps, asks","Short, scannable updates build trust.",Weekly cadence with busy sponsors,Risk,3,4,Observed,Guideline,Communication,N,Project Manager,Consulting,nan,Any,nan,2025-08-01 00:00:00,Reddit | r/projectmanagement – status templates,https://www.reddit.com/r/projectmanagement/comments/1gp7y70/status_reporting_ppt_templates/,nan
