description,rationale,use_case,impact_area,transferability_score,actionability_rating,evidence_strength,type_(form),tag_(application),unique?,role,function,company,industry,country,date,source_(interview_#_/_name),link,notes
Use XLOOKUP + structured tables instead of VLOOKUP on ranges,Fewer brittle formulas; auto-expands with data.,Working with evolving datasets,Efficiency,3,3,Observed,Guideline,Data Hygiene,N,Consultant,Consulting,nan,Any,nan,2025-08-01 00:00:00,Microsoft – XLOOKUP,https://support.microsoft.com/office/xlookup-function-78a5d9fd-7a29-4b9c-b6ec-0a6b274e7205,Exact match by default; handles left/right.
Footer shows file name + version on every printed deck,People can trace stray printouts.,Printed SteerCo binders,Efficiency,4,3,Observed,Tactical,Documentation,N,Consultant,Consulting,nan,Any,nan,2025-08-01 00:00:00,Microsoft – slide numbers/footers,https://support.microsoft.com/office/add-slide-numbers-2db6c292-4b4a-4a90-b3bf-f40f2e7444ba,Helps reconcile feedback to file.
Use Slide Master to lock grids/margins; only content placeholders on child layouts,Prevents alignment drift and rework across big decks.,Large decks with multiple editors,Efficiency,2,3,Observed,Guideline,Enablement,N,Consultant,Consulting,nan,Professional Services,nan,2025-08-01 00:00:00,Microsoft – Slide Master,https://support.microsoft.com/office/use-slide-masters-to-customize-a-presentation-3d9c08b7-7c54-4c2a-8e1f-88eae3df7d8f,Enforce header/body/footer positions.
Selection Pane trick: layer clickable storyboards without new tools,Clickable flows in PPT avoid tool-switching.,Prototype UX without Figma,Efficiency,2,3,Observed,Tactical,Feature Design,Y,Consultant,Consulting,nan,Any,nan,2025-08-01 00:00:00,Microsoft – Selection Pane,https://support.microsoft.com/office/using-the-selection-pane-4f3c3d42-28b8-4b8e-b6f4-71d1d8f0d1f3,Hide/show layers per click path.
Export PDF with embedded fonts + downsampled images,Avoids missing fonts and huge file sizes on client laptops.,Deliverables to procurement/boards,Efficiency,3,3,Observed,Guideline,Data Hygiene,Y,Consultant,Consulting,nan,Any,nan,2025-08-01 00:00:00,Microsoft – Save as PDF,https://support.microsoft.com/office/save-or-convert-to-pdf-4b85b9a9-12b0-4d58-9f86-9aa0e26a2544,Check 'ISO 19005-1 compliant (PDF/A)'.
Lock sheets and protect workbook structure on client-facing models,Prevents accidental edits and formula loss.,Sharing Excel models,Efficiency,2,3,Observed,Tactical,Safety,Y,Consultant,Consulting,nan,Any,nan,2025-08-01 00:00:00,Microsoft – Protect sheet/workbook,https://support.microsoft.com/office/protect-a-worksheet-3179efdb-64b5-4c0d-9d3f-2ab6363e0ae3,Unlock inputs only.
Use Presenter View; rehearse with timer and next-slide preview,Reduces slide reading and over-runs.,High-stakes presentations,Efficiency,2,3,Observed,Tactical,Enablement,N,Consultant,Consulting,nan,Any,nan,2025-08-01 00:00:00,Microsoft – Presenter View,https://support.microsoft.com/office/start-the-presentation-and-see-your-notes-in-presenter-view-4e07f0b3-00b4-4ea0-bc3b-f7fc1de8423a,Dual-screen recommended.
Power Query your data cleaning steps and click Refresh weekly,Repeatable ETL beats manual edits.,Weekly KPI packs / ops reports,Efficiency,1,4,Observed,Guideline,Productivity,Y,Consultant,Consulting,nan,Any,nan,2025-08-01 00:00:00,Microsoft – Get & Transform,https://support.microsoft.com/office/get-transform-in-excel-2016-8a18a8f3-5b9a-48c5-b7b6-0641f5d66b4b,Record split/trim/dedupe/type steps.
Use Dynamic Arrays (FILTER/UNIQUE/SORT) to build live exhibits,Eliminates copy/paste and stale numbers.,One-pagers that must stay current,Efficiency,2,3,Observed,Tactical,Quality Assurance,Y,Consultant,Consulting,nan,Any,nan,2025-08-01 00:00:00,Microsoft – Dynamic arrays,https://support.microsoft.com/office/dynamic-array-formulas-2f8b7cb7-4336-4a6b-8f99-2f3c6f9b4e7c,Spill ranges stay synced with source.
Conditional formatting for RAG and deltas in summary tables,Faster scan for executives.,Status one-pagers,Efficiency,2,3,Observed,Tactical,Feature Design,N,Consultant,Consulting,nan,Any,nan,2025-08-01 00:00:00,Microsoft – Conditional formatting,https://support.microsoft.com/office/conditional-formatting-106f4d3e-980a-48b2-8864-8f389f6a3d3a,Icon sets + data bars for at-a-glance.
Use Track Changes/Compare for SOW redlines,Clean review history reduces legal churn.,Contracting cycles,Risk,3,3,Observed,Tactical,Negotiation,Y,Consultant,Consulting,nan,Any,nan,2025-08-01 00:00:00,Microsoft – Compare docs,https://support.microsoft.com/office/compare-documents-using-the-legal-blackline-option-1e90842f-2628-4ed1-8f5b-9f827b0d17ff,"Prefer DOCX, not PDFs, for redlining."
Use Saga (choreography or orchestration) for multi-step distributed transactions,Choose choreography for simple flows; orchestration for control.,Handle cross-service workflows without 2PC,Efficiency,3,4,Observed,Guideline,"Planning, Safety",Y,Enterprise Architect,IT,nan,Services,nan,2025-08-01 00:00:00,microservices.io (Chris Richardson,https://microservices.io/patterns/data/saga.html,nan
Use the Transactional Outbox pattern for reliable events from DB writes,Write to local outbox table then relay asynchronously.,Prevent lost messages on commit/emit races,Efficiency,3,4,Observed,Guideline,"Quality Assurance, Safety",Y,Enterprise Architect,IT,nan,Data,nan,2025-08-01 00:00:00,microservices.io (Chris Richardson,https://microservices.io/patterns/data/transactional-outbox.html,nan
Exclude existing customers from TOF awareness spend to avoid wasting budget and overexposing them to brand ads.,Prevents ad fatigue and keeps brand impressions relevant to stage.,Audience hygiene,Efficiency,5,5,Observed,checklist item,Audience targeting,N,Paid Media Manager,Marketing,UNK,Multi,UNK,2024-01-15,Meta for Business Help,https://www.facebook.com/business/help/629864800942497,Meta docs: use exclusion audiences to control delivery.
Avoid unverifiable claims in messaging; anchor value props in benefits you can show and measure.,Over‑promising erodes trust and invites legal risk; proof wins.,Positioning for security/privacy or performance claims.,Clarity,5,4,Observed,Guideline,"Messaging, Positioning",Y,PMM,Marketing,—,Software,—,2017-12-04 00:00:00,meta,https://github.com/monero-project/meta/issues/146,Representative source for rule: provable_claims
Avoid unverifiable claims in messaging; focus on benefits you can prove and demonstrate.,Over‑promising creates legal and trust risks; clear benefits convert better.,Product marketing for privacy/security tools.,Clarity,5,4,Observed,Guideline,"Messaging, Positioning",N,PMM,Marketing,—,Software,—,2017-12-04 00:00:00,meta,https://github.com/monero-project/meta/issues/146,Mined from GitHub issue via rule: messaging_claims
Send calendar invites with clear titles like 'Kickoff: Marketing Ops Platform (30 mins)' instead of vague labels.,Improves attendance and context-setting.,Calendar hygiene,Efficiency,1,3,Anecdotal,Guideline,Clarity/Time Management,N,Executive Assistant,Operations,,Marketing,,2025-08-01 00:00:00,Meeting ops playbook,nan,nan
Designate a 'decision owner' in every meeting to drive closure.,Prevents endless follow-ups or ambiguity.,Cross-functional meetings,Efficiency,1,3,Anecdotal,Tactical,Accountability/Facilitation,Y,Operations Manager,Operations,,Retail,,2025-08-01 00:00:00,Meeting management guide,nan,nan
"Prefer 'least surprise' HTTP status codes: 201 for create, 202 for async, 409 for conflicts",Consistent semantics reduce support load.,Make APIs self-explanatory to integrators,Efficiency,3,3,Observed,Guideline,"Clarity, Documentation",N,Enterprise Architect,IT,nan,APIs,nan,2025-08-01 00:00:00,MDN HTTP status,https://developer.mozilla.org/docs/Web/HTTP/Status,nan
Cache-validate with ETag/If-None-Match for read-heavy endpoints,Conditional requests avoid full payloads when unchanged.,Reduce bandwidth and speed up reads,Efficiency,3,3,Observed,Tactical,"Quality Assurance, Performance Bottlenecks",Y,Enterprise Architect,IT,nan,APIs,nan,2025-08-01 00:00:00,MDN HTTP caching,https://developer.mozilla.org/docs/Web/HTTP/Headers/ETag,nan
"For cross-origin PoCs, configure CORS narrowly per route + method","Avoid '*' in production; restrict origins, headers, methods.",Allow just what the browser needs for the PoC,Efficiency,3,3,Observed,Guideline,"Safety, Documentation",Y,Sales Engineer,Sales Engineering,nan,Web,nan,2025-08-01 00:00:00,MDN CORS,https://developer.mozilla.org/docs/Web/HTTP/CORS,nan
Enforce API request size limits and return 413 with guidance,Document max sizes and recommend ch ing or S3 uploads.,Protect services from oversized payloads,Efficiency,1,3,Observed,Guideline,"Quality Assurance, Communication",N,Enterprise Architect,IT,nan,APIs,nan,2025-08-01 00:00:00,MDN / RFC 7231,https://developer.mozilla.org/docs/Web/HTTP/Status/413,nan
"Create 'feature crosses' (e.g., bins × categories) and discretize skewed continuous variables.",Exposes threshold effects and interactions to simpler models.,When trees overfit and linear models underfit.,Efficiency,1,3,Observed,Tactical,"Feature Design, Pattern Recognition",N,Kaggle Users,Data Science,Kaggle,Analytics,nan,2024-01-01 00:00:00,Md Asif Ikbal; MOHAMMAD SAAD KHAN (Kaggle,https://www.kaggle.com/discussions/questions-and-answers/477245,Coarse bins reduce noise; tune binning via CV.
Create a glossary for any strategic document over 5 pages to reduce confusion.,Supports cross-functional understanding.,Strategy or planning docs,Efficiency,2,3,Anecdotal,Guideline,Clarity/Documentation,N,Strategy Associate,Strategy,,Consulting,,2025-08-01 00:00:00,McKinsey Writing Standards,nan,nan
Use a 'single sentence summary' at the top of strategy docs to align diverse readers quickly.,Helps non-domain leaders grasp core message fast.,Quarterly strategy presentations,Efficiency,1,3,Anecdotal,Guideline,Clarity/Executive Alignment,Y,Strategy Consultant,Strategy,,Consulting,,2025-08-01 00:00:00,McKinsey internal doc format,nan,nan
"In fast-changing orgs, revisit RACI matrices quarterly to avoid hidden ownership drift.",Keeps clarity as orgs evolve quickly.,Team role clarity,Efficiency,1,4,Anecdotal,pattern,Accountability/Internal Politics,Y,Coo,Operations,,Enterprise,,2025-08-01 00:00:00,McKinsey execution guidance,nan,nan
"As a facilitator, don't use the meeting as your platform—focus on encouraging high‑quality conversations among participants rather than pushing your own views","The facilitator's role is to guide conversation, not promote personal opinions【580191659819919†screenshot】",Workshop mindset,Efficiency,2,4,Anecdotal,cue,Facilitation,N,Nan,Facilitation,,General,nan,2025-07-21 00:00:00,Matthew Skelton blog,nan,nan
"Before facilitating a round-table, research participants' backgrounds and expectations and write down their names; ensure everyone introduces themselves",Prepare by understanding participants and noting their names to encourage introductions【93329248034715†screenshot】,Workshop preparation,Efficiency,2,3,Anecdotal,Tactical,Facilitation,N,Nan,Facilitation,,General,nan,2025-07-21 00:00:00,Matthew Skelton blog,nan,nan
Encourage quieter participants by calling them by name and gently redirecting over‑talkers so everyone has a chance to speak,Call quieter people by name and redirect chatty participants to ensure everyone speaks【580191659819919†screenshot】,Inclusive discussion,Efficiency,2,4,Anecdotal,cue,Facilitation,N,Nan,Facilitation,,General,nan,2025-07-21 00:00:00,Matthew Skelton blog,nan,nan
"Keep the discussion on track: periodically check against your list of questions, ask bridging questions to move between topics, and finish on time with a summary of key points",Use bridging questions and summaries to cover key points and end on time【936883547210704†screenshot】【5753063827603†screenshot】,Time management in workshops,Efficiency,2,3,Anecdotal,Tactical,Facilitation,N,Nan,Facilitation,,General,nan,2025-07-21 00:00:00,Matthew Skelton blog,nan,nan
"Prepare the discussion topic thoroughly: know enough about the subject, create a list of guiding questions, share them with participants and include a little controversy to spark debate","Facilitators should prepare questions and understand the topic, sharing them ahead of time and adding controversy if needed【580191659819919†screenshot】",Workshop planning,Efficiency,2,4,Anecdotal,Tactical,Facilitation,N,Nan,Facilitation,,General,nan,2025-07-21 00:00:00,Matthew Skelton blog,nan,nan
"Map 'moments × goals' before ideation; design content that helps the customer accomplish a goal in each moment, across the lifecycle.",Context marketing aligns artifacts to real customer motivation instead of generic funnels.,Planning a content/program roadmap tied to customer journeys.,Efficiency,2,3,Observed,Guideline,"Pattern Recognition, Planning",Y,Director Of Market Strategy,Marketing,Wellspring Digital (podcast transcript),Marketing,nan,,Mathew Sweezey (interview quotes,https://wellspringdigital.com/blog/tasty-nuggets-of-wisdom-from-todays-top-marketers-part-one/,"Two‑step frame: focus on goals-in-moments, then apply across lifecycle."
Mastercard 4808: avoid authorization‑related chargebacks—final capture should match auth amount or be re‑authorized; observe authorization validity windows.,Mastercard rules define 4808 conditions and protection windows.,E‑commerce capture/adjust flows.,Efficiency,2,3,Observed,Guideline,"Clarity, Testing",Y,Payments Engineer,Engineering,Mastercard,Financial Services,Global,2025-06-01 00:00:00,Mastercard Transaction Processing Rules (June 2025,https://www.mastercard.com/content/dam/mccom/shared/business/support/rules-pdfs/transaction-processing-rules.pdf,"Avoid partial, stale captures that exceed allowed timelines."
Prevent Mastercard 4808 chargebacks: capture/finalize correctly—settled amount must equal authorized amount; observe preauth time limits.,Mastercard rules define 4808 authorization‑related chargebacks and protection periods.,E‑commerce capture flows and post‑auth edits.,Efficiency,2,3,Observed,Guideline,"Clarity, Testing",Y,Payments Engineer,Engineering,Mastercard,Financial Services,Global,2025-06-01 00:00:00,Mastercard Transaction Processing Rules (June 2025,https://www.mastercard.com/content/dam/mccom/shared/business/support/rules-pdfs/transaction-processing-rules.pdf,Avoid partial captures unless re‑authorized; align with protection windows.
Mastercard Account Updater (VAU/ABU): enroll to receive updated PAN/expiry for recurring billing; reduces involuntary churn.,Networks offer updaters to keep credentials current after reissue/expiry.,Subscription/card‑on‑file programs.,Revenue,1,3,Observed,Guideline,"Forecasting, Productivity",N,Billing Ops Lead,Operations,Mastercard,Financial Services,Global,2024-05-01 00:00:00,Mastercard Automatic Billing Updater,https://www.mastercard.us/en-us/business/issuers/products-and-solutions/automatic-billing-updater.html,Combine with retry logic tuned to issuer behaviors.
Adopt optimistic concurrency with entity version fields to prevent lost updates,Include ETag/If-Match or version column to detect conflicts.,Protect concurrent writes in APIs,Efficiency,1,3,Observed,Guideline,"Quality Assurance, Documentation",Y,Enterprise Architect,IT,nan,APIs,nan,2025-08-01 00:00:00,Martin Fowler (Patterns of Enterprise Application Architecture,https://martinfowler.com/eaaCatalog/optimisticOfflineLock.html,nan
Use 'expand/contract' DB changes to avoid downtime,Keeps migrations safe and reversible.,Schema-changing features,Efficiency,2,3,Observed,Guideline,Quality Assurance,Y,Product Manager,Product Management,nan,nan,nan,2025-08-01 00:00:00,Martin Fowler – Parallel Change,https://martinfowler.com/bliki/ParallelChange.html,"Plan additive, migrate, then remove old."
Create feature toggles for long-running work (branch by abstraction),Avoids long-lived branches; ship incrementally.,Large refactors or risky features,Efficiency,1,3,Observed,Guideline,Technical Debt,Y,Product Manager,Product Management,nan,nan,nan,2025-08-01 00:00:00,Martin Fowler – Feature Toggles,https://martinfowler.com/articles/feature-toggles.html,Release independently of deploy.
"The best content addresses a specific pain, not just your product's features.","This wisdom focuses on solving the customer's problem first, which builds trust and positions your company as a helpful resource. The product is then presented as the solution.",A marketing team is brainstorming new content ideas.,"Revenue, Strategic Planning",5,5,Peer-validated,Rule-of-thumb,"Content Marketing, Strategic Planning",N,"Content Marketer, PMM",Marketing,,B2B,,2024-04-01 00:00:00,MarketingProfs Blog,,"A common mistake is to ""talk about yourself too much."""
"To show the value of marketing to the CMO, create a single dashboard that shows the entire customer journey.","This dashboard should show the flow of a customer from first touch to revenue, demonstrating how marketing activities contribute to the bottom line.",A marketing leader is preparing for a quarterly business review with the C-suite.,"Strategic Planning, Communication",5,5,Peer-validated,Checklist Item,"Analysis, Strategic Planning",N,"Marketing Ops, CMO",Marketing,,B2B,,2024-04-01 00:00:00,MarketingProfs Blog,,"The key is to tell a story with the data, not just present a list of numbers."
"Review funnel metrics (CTR, CVR, CAC) alongside brand health KPIs (share of search, aided recall) in monthly performance decks.",Prevents short‑term optimizations from eroding brand equity and future demand.,Integrated KPI review,Revenue,5,3,Observed,checklist item,Measurement,N,CMO; Marketing Analyst,Marketing; Analytics,UNK,Multi,UNK,2024-04-18,Mark Ritson (Marketing Week column),https://www.marketingweek.com/mark-ritson-measurement/,Ritson advocates tracking brand and activation together for full-funnel ROI.
Send a 'before we meet' agenda the day prior to reduce context-switching at the start.,Boosts clarity and prep quality.,Team syncs or stakeholder meetings,Efficiency,2,4,Anecdotal,cue,Facilitation/Communication,N,Project Lead,Operations,,Tech,,2025-08-01 00:00:00,Manager Tools Podcast,nan,nan
Publish a security policy with a responsible disclosure process and a private intake channel.,Clear paths for reporting reduce time‑to‑fix and legal risk.,Any product with external users or partners.,Safety,5,4,Observed,Guideline,"Safety, Accountability",Y,Security Lead,Security,—,Software,—,2019-12-02 00:00:00,lucene,https://github.com/apache/lucene/issues/10119,Representative source for rule: security_policy
"Defaulting to channels instead of DMs improves transparency, searchability, and institutional memory across teams.","Work conducted in channels is visible to all, providing context to current and future team members while reducing duplication and improving knowledge continuity.",Communication norm setting,Efficiency,5,5,Data-backed,rule-of-thumb,Documentation,N,Team Lead,General,Slack,Technology,US,2025-05-15 00:00:00,Lucas Puente,https://slack.com/blog/productivity/how-slack-power-users-get-more-done,Applies broadly in remote and hybrid teams.
Power users automate repetitive tasks in Slack using workflows and integrations to improve team responsiveness and reduce manual updates.,"Automations keep work flowing without requiring human follow-ups and ensure consistency in responses, especially for FAQs or onboarding.",Internal operations automation,Efficiency,5,5,Data-backed,workaround,Pattern Recognition,N,Operations Lead,Operations,Slack,Technology,US,2025-05-15 00:00:00,Lucas Puente,https://slack.com/blog/productivity/how-slack-power-users-get-more-done,Users report 26% higher productivity using automations.
"Slack power users customize notifications, sidebars, and visual themes to shape the workspace around how they work best.","Personalized settings reduce distraction and cognitive load, enabling faster focus and task switching.",Workflow customization,Efficiency,4,4,Observed,pattern,Clarity,N,Knowledge Worker,General,Slack,Technology,US,2025-05-15 00:00:00,Lucas Puente,https://slack.com/blog/productivity/how-slack-power-users-get-more-done,Customization noted as a consistent trait of power users.
Use Loom 3-minute walkthroughs instead of status meetings,Cuts meetings while keeping stakeholders warm.,Explaining complex changes quickly,Efficiency,3,3,Observed,Tactical,Time Management,Y,Consultant,Consulting,nan,Any,nan,2025-08-01 00:00:00,Loom blog + practice,https://www.loom.com/blog,Caption + chapter the video.
"In onboarding docs, bold action verbs and include screenshots for each step.",Improves scanability and usability.,New hire or customer onboarding,Retention,2,4,Anecdotal,Tactical,Documentation/Enablement,N,Training Specialist,Operations,,General,,2025-08-01 00:00:00,Loom Blog,nan,nan
"After sprint planning, post a video walkthrough of the board for async alignment.",Saves meeting time and improves clarity.,Remote scrum team planning,Efficiency,3,3,Anecdotal,Tactical,Communication/Enablement,Y,Scrum Master,Engineering,,Remote Tools,,2025-08-01 00:00:00,Loom Agile Use Cases,nan,nan
Use a one-line 'why this matters' on every dashboard metric card.,Improves business context for non-analysts.,BI tool setup,Efficiency,1,3,Anecdotal,Tactical,Enablement/Forecasting,Y,Data Analyst,Analytics,,SaaS,,2025-08-01 00:00:00,Looker Community Best Practices,nan,nan
"Don't just say ""no"" to a business unit's spending request. Say, ""Yes, and here's what it will take.""","This shifts the conversation from being an obstacle to being a partner. It allows you to present the trade-offs and help the business unit prioritize their goals, becoming a strategic advisor.",A sales team leader asks for a larger budget for a new initiative.,"Collaboration, Efficiency",5,5,Anecdotal,Workaround,"Negotiation, Strategic Planning",N,"FP&A Analyst, CFO",Finance,,Any,,2024-03-01 00:00:00,LinkedIn Post from Finance Leader,,"The ""what it will take"" part of the phrase is where you build value and trust."
"When you're asked to present financial data to leadership, use a ""30-10-5"" rule. The first 30 seconds should be the most important takeaway, the next 10 minutes are for the supporting evidence, and the last 5 are for Q&A and next steps.","This rule ensures that even the busiest executive can get the main point of your presentation, making you a more efficient and valued contributor.",Presenting a financial analysis to a group of busy executives.,"Communication, Efficiency",5,5,Anecdotal,Rule-of-thumb,"Presentations, Analysis",N,"FP&A Analyst, CFO",Finance,,Any,,2024-04-01 00:00:00,LinkedIn Post from Finance Leader,,A common mistake is to get lost in the weeds and not get to the point.
Apply 'Messaging House' framework for brand and product messaging clarity.,"Helps teams structure messaging by layering Brand prop, product description, customer problem, needs/wants, value props, and benefits/features.",Creating messaging collateral aligned to value delivery.,Clarity & Focus,4,4,Observed,Framework,"Messaging, Positioning",N,Brand & Product Marketing,Marketing,Webflow,Software,UNK,2025-08-01 00:00:00,LinkedIn post by Vikas Bhagat,https://www.linkedin.com/posts/vikasbhagat_messaging-framework-activity-xxxxxx,Focuses on breaking down messaging into layered structure for clarity and alignment. Strong emphasis on competitive positioning and intersection with customer values.
"Use a ""tech radar"" to communicate technology strategy and manage governance.","A tech radar provides a visual, clear framework for discussing which technologies to adopt, hold, assess, or retire, driving consensus and a common language.",Aligning multiple business units on technology choices for a new enterprise-wide system.,"Efficiency, Strategic Planning",4,4,Peer-validated,Checklist Item,"Strategic Planning, Governance",N,Enterprise Architect,"Strategy, IT",,Technology,,2024-01-01 00:00:00,LinkedIn Post by Senior EA,,The tool itself is less important than the conversation it enables.
"Use a ""tech radar"" to communicate technology strategy and manage governance.","A tech radar provides a visual, clear framework for discussing which technologies to adopt, hold, assess, or retire, driving consensus and a common language.",Aligning multiple business units on technology choices for a new enterprise-wide system.,"Efficiency, Strategy",4,4,Peer-validated,Checklist Item,"Strategic Planning, Governance",N,Enterprise Architect,"Strategy, IT",,Technology,,2024-01-01 00:00:00,LinkedIn Post by Senior EA,,The tool itself is less important than the conversation it enables.
"Use a framework like TOGAF or Zachman, not as a rigid rulebook, but as a communication tool.","These frameworks provide a common language and structure for discussing complex architectural problems, making it easier to get buy-in from both technical and business stakeholders.",Kicking off a new enterprise-wide technology strategy project.,"Strategy, Communication",4,4,Peer-validated,Pattern,"Strategic Planning, Collaboration",N,Enterprise Architect,"Strategy, IT",,Technology,,2024-01-01 00:00:00,LinkedIn Post by Senior EA,,A common mistake is to get bogged down in the framework itself.
"When trying to standardize technology, use a ""storytelling"" approach to communicate the benefits.","Presenting technical benefits (e.g., ""reduced latency"") doesn't resonate with business leaders. Telling a story about how it impacts a specific business unit's goals (e.g., ""We can now process 2x more orders"") builds buy-in.",Presenting a new technology standard to a non-technical leadership team.,"Strategy, Collaboration",5,5,Peer-validated,Pattern,"Strategic Planning, Communication",N,Enterprise Architect,"Strategy, IT",,Technology,,2024-01-01 00:00:00,LinkedIn Post by Senior EA,,"The focus should be on the business outcome, not the technical implementation."
