description,rationale,use_case,impact_area,transferability_score,actionability_rating,type_(form),tag_(application),source_(interview_#/_name),link,notes,evidence_strength,unique?,role,function,company,industry,country,date,source,filepath
When you must run a trial: define success criteria; limit to 3–5 business days; set check-ins,Qualify + criteria + short window + day-by-day check-ins.,Avoid zombie trials and create urgency,Efficiency,1,3,Guideline,Testing; Deal Control,Reddit | ready_4_the_mayans,https://www.reddit.com/r/sales/comments/ut52p8/tips_on_how_to_say_no_to_a_free_saas_trial/,,,,,,,,,,GoogleSheets,Manual Import: my_insights.csv
Don't custom-build a full ERP/MRP; use commercial systems—one developer can't replicate planning modules.,"MRP, scheduling, financials, and integrations are too complex to recreate reliably.",Leadership pushing an internal ERP as a 'quick win'.,Efficiency,3,2,warning,"Risk Triage, Planning","Reddit | r/sysadmin — ""Our ERP programmer is a disaster…""",https://www.reddit.com/r/sysadmin/comments/1il4ebg/our_erp_programmer_is_a_disaster_and_my_boss/,Experienced take: custom ERP is unrealistic beyond simple CRM/inventory.,,,,,,,,,GoogleSheets,Manual Import: my_insights.csv
Use two-bin Kanban math: set total cards ~2× average consumption between replenishments; place reorder at halfway.,Simple rule keeps service level without complex MRP for small parts.,Point-of-use fasteners/consumables.,Efficiency,1,3,Tactical,"Planning, Resource Management","Reddit | r/supplychain — ""Kanban cards"" (rule of thumb",https://www.reddit.com/r/supplychain/comments/11l10up/kanban_cards/,Comment describes doubling and second card at halfway.,,,,,,,,,GoogleSheets,Manual Import: my_insights.csv
Cancel meetings without a purpose or agenda; send update email instead,"Meetings are for decisions, not info dumps.",Weekly team/status meetings,Efficiency,3,3,Guideline,Time Management,Reddit | r/smallbusiness – meeting best practices,https://www.reddit.com/r/smallbusiness/comments/taxwqk/what_are_your_best_practices_for_running_an/,,,,,,,,,,GoogleSheets,Manual Import: my_insights.csv
Bring a 'safe offline' demo deck or MP4 in case SSO/VPN blocks screen control,"When screen control or SSO fails, switch to short video proof points.",Keep momentum when conferencing tools or security policies fail,Efficiency,2,3,Tactical,"Testing, Risk",Reddit | r/salesengineers war stories,https://www.reddit.com/r/salesengineers/,,,,,,,,,,GoogleSheets,Manual Import: my_insights.csv
Start demos with clear agenda/timeboxing; park deep dives in a 'parking lot',Clarify agenda + time; park deep Qs to return later.,Prevent derailed demos and keep narrative tight,Efficiency,1,3,Guideline,"Facilitation, Deal Control",Reddit | r/salesengineers thread,https://www.reddit.com/r/salesengineers/comments/1dyhw1w/how_do_you_handle_excessive_questions_during_demo/,,,,,,,,,,GoogleSheets,Manual Import: my_insights.csv
Use a dedicated sandbox tenant with fixed seed data; reset before every demo,Script a reset; keep sample records realistic for the target vertical.,Avoid stale data and permissions drift breaking the flow,Efficiency,5,4,Guideline,"Quality Assurance, Data Hygiene",Reddit | r/salesengineers setup threads,https://www.reddit.com/r/salesengineers/,,,,,,,,,,GoogleSheets,Manual Import: my_insights.csv
Disable desktop notifications and set Do Not Disturb before screen-sharing,Turn off notifications; declutter; zoom 125%; hide bookmarks.,Avoid distracting pop-ups and confidentiality leaks,Efficiency,1,3,Tactical,"Quality Assurance, Facilitation",Reddit | r/salesengineers hygiene,https://www.reddit.com/r/salesengineers/,,,,,,,,,,GoogleSheets,Manual Import: my_insights.csv
Keep a pre-recorded 90-second fallback clip for risky live steps,Short MP4 clip for the one risky step if live system stalls.,Protect demos against flaky network or environments,Risk,2,4,Tactical,"Testing, Risk",Reddit | r/salesengineers hygiene,https://www.reddit.com/r/salesengineers/,,,,,,,,,,GoogleSheets,Manual Import: my_insights.csv
"Use a demo checklist: env reset, seed data, auth tokens valid, feature flags correct",Pre-flight avoids 'works on my machine' moments.,Reduce demo surprises from stale envs,Efficiency,5,4,Guideline,"Quality Assurance, Data Hygiene",Reddit | r/salesengineers checklists,https://www.reddit.com/r/salesengineers/,,,,,,,,,,GoogleSheets,Manual Import: my_insights.csv
Offer to co-author a one-page Business Case with their champion,"Problem, current cost, future state, risks, timeline, owners.",Arm the champion to sell internally,Risk,1,3,Guideline,"Executive Alignment, Documentation",Reddit | r/salesengineers + r/sales,https://www.reddit.com/r/salesengineers/,,,,,,,,,,GoogleSheets,Manual Import: my_insights.csv
Ask for a data sample early (CSV/JSON) to validate field availability and quality,Early profiling prevents PoC stalls due to missing keys.,Avoid surprises when mapping integrations,Efficiency,1,3,Tactical,"Data Hygiene, Discovery",Reddit | r/salesengineers,https://www.reddit.com/r/salesengineers/,,,,,,,,,,GoogleSheets,Manual Import: my_insights.csv
Bring a pre-written 'exec summary' email you can send in 2 minutes post-call,"Template: pains heard, proof shown, agreed next step, owners, dates.",Lock in commitments and who-owns-what while fresh,Efficiency,5,4,Tactical,"Documentation, Accountability",Reddit | r/salesengineers,https://www.reddit.com/r/salesengineers/,,,,,,,,,,GoogleSheets,Manual Import: my_insights.csv
"Confirm environment parity: demo ≈ what the buyer will get (versions, flags)",,Avoid credibility hits when PoC differs from prod,Efficiency,3,3,Guideline,"Quality Assurance, Clarity",Reddit | r/salesengineers,,,,,,,,,,,GoogleSheets,Manual Import: my_insights.csv
Define PoC exit criteria in writing and get buyer sign-off before starting,Signed criteria + success owner + timebox are prerequisites.,Prevent scope creep and 'eternal PoCs',Efficiency,1,3,Guideline,"Accountability, Testing",Reddit | r/salesengineers,https://www.reddit.com/r/salesengineers/,,,,,,,,,,GoogleSheets,Manual Import: my_insights.csv
End every demo with a 90-second recap and a one-click calendar link for next steps,Use Calendly/HubSpot link; ask for decision process confirmation.,Turn interest into scheduled action while energy is high,Efficiency,1,4,Tactical,"Accountability, Clarity",Reddit | r/salesengineers,https://www.reddit.com/r/salesengineers/,,,,,,,,,,GoogleSheets,Manual Import: my_insights.csv
"For browser-based demos, pre-warm tabs and disable auto-update banners",Kill extensions that add overlays; set a clean profile.,Reduce lag and UI surprises on live calls,Efficiency,1,3,Tactical,"Quality Assurance, Facilitation",Reddit | r/salesengineers,https://www.reddit.com/r/salesengineers/,,,,,,,,,,GoogleSheets,Manual Import: my_insights.csv
Have an 'Oops Path' slide ready—what happens if a step fails?,"Demo the error UX briefly: retries, rollbacks, support path.",Show maturity by acknowledging failure handling,Efficiency,1,4,Tactical,"Facilitation, Safety",Reddit | r/salesengineers,https://www.reddit.com/r/salesengineers/,,,,,,,,,,GoogleSheets,Manual Import: my_insights.csv
"If a question requires deep dive, book a follow-up with the right SME",Parking-lot then schedule SME follow-up.,Maintain flow and bring the right expertise,Efficiency,1,4,Guideline,"Escalation, Team Dynamics",Reddit | r/salesengineers,https://www.reddit.com/r/salesengineers/,,,,,,,,,,GoogleSheets,Manual Import: my_insights.csv
"If buyer requests 'just a quick generic demo', insist on 3 pains first or reschedule",Generic tours rarely convert; get 3 pains or reset the call.,"Avoid low-probability, unfocused demos",Efficiency,1,4,warning,"Scoping, Requirements",Reddit | r/salesengineers,https://www.reddit.com/r/salesengineers/,,,,,,,,,,GoogleSheets,Manual Import: my_insights.csv
"Keep a one-page integration map showing auth, data flow, events, and error paths",Picture > words; include retry/backoff and failure handling.,Give execs and architects a single artifact to react to,Efficiency,1,3,Guideline,"Documentation, Communication",Reddit | r/salesengineers,https://www.reddit.com/r/salesengineers/,,,,,,,,,,GoogleSheets,Manual Import: my_insights.csv
"Pin a short mutual agenda in the calendar invite: Objectives, Roles, Success Criteria",People read the invite; it sets boundaries for what the meeting is (and isn't).,Pre-wire expectations and avoid mid-call resets,Efficiency,2,3,Guideline,"Planning, Accountability",Reddit | r/salesengineers,https://www.reddit.com/r/salesengineers/,,,,,,,,,,GoogleSheets,Manual Import: my_insights.csv
Pre-agree a demo agenda in the calendar invite; include objectives and roles,"Calendar invite carries scope, objectives, roles.",Avoid surprises and keep meetings tight,Efficiency,1,3,Tactical,"Facilitation, Planning",Reddit | r/salesengineers,https://www.reddit.com/r/salesengineers/,,,,,,,,,,GoogleSheets,Manual Import: my_insights.csv
Run dry-runs with a colleague who plays the 'interrupter' role,Practice reset phrases and steering back to agenda.,Build muscle memory for regaining control after interruptions,Efficiency,1,3,Guideline,"Team Dynamics, Testing",Reddit | r/salesengineers,https://www.reddit.com/r/salesengineers/,,,,,,,,,,GoogleSheets,Manual Import: my_insights.csv
Schedule security questionnaires/DPAs in the MAP to avoid end-game delays,Make security artifacts first-class milestones.,Move infosec reviews earlier in the cycle,Risk,3,3,Tactical,"Planning, Documentation",Reddit | r/salesengineers,https://www.reddit.com/r/salesengineers/,,,,,,,,,,GoogleSheets,Manual Import: my_insights.csv
Session-record and chapter-mark the demo before sharing broadly,"Chapters: discovery highlights, 3 proofs, objections, next steps.","Give busy SMEs the 90 seconds they need, not 45 minutes",Efficiency,1,4,Guideline,"Collaboration, Time Management",Reddit | r/salesengineers,https://www.reddit.com/r/salesengineers/,,,,,,,,,,GoogleSheets,Manual Import: my_insights.csv
Show 'admin break-glass' flows only if asked; buyers fear accidental risk,Don't demo dangerous toggles unless a security stakeholder requests it.,Avoid triggering security concerns mid-demo,Risk,1,4,warning,"Safety, Internal Politics",Reddit | r/salesengineers,https://www.reddit.com/r/salesengineers/,,,,,,,,,,GoogleSheets,Manual Import: my_insights.csv
Use 'reverse demo' for discovery-heavy orgs—have the buyer share their screen first,They narrate process; you mirror with targeted paths only.,Expose true workflows and data constraints before showing anything,Efficiency,1,3,Guideline,"Discovery, Facilitation",Reddit | r/salesengineers,https://www.reddit.com/r/salesengineers/,,,,,,,,,,GoogleSheets,Manual Import: my_insights.csv
Use a 'parking lot' doc link in chat so deferred questions aren't lost,Drop a shared doc link; capture owner and due date live.,Defer deep dives without losing commitments,Efficiency,1,3,Tactical,"Documentation, Facilitation",Reddit | r/salesengineers,https://www.reddit.com/r/salesengineers/,,,,,,,,,,GoogleSheets,Manual Import: my_insights.csv
"Use a 'reverse demo'—prospect narrates process first, then show matching paths",Buyer drives; you show the path that fits.,Maximize relevance and reduce fatigue,Efficiency,1,4,Guideline,"Discovery, Scoping",Reddit | r/salesengineers,https://www.reddit.com/r/salesengineers/,,,,,,,,,,GoogleSheets,Manual Import: my_insights.csv
Whiteboard the 'target day-in-the-life' before any screenshare,Sketch the flow; then show the critical path only.,Align on desired workflow; eliminate irrelevant demo paths,Efficiency,1,4,Guideline,"Facilitation, Planning",Reddit | r/salesengineers,https://www.reddit.com/r/salesengineers/,,,,,,,,,,GoogleSheets,Manual Import: my_insights.csv
Cap generic demos at ≤30 minutes; show 3 things that map to pain,Better three targeted wins than a 60-min sweep.,Avoid feature tours; focus on pain-resolution,Efficiency,1,3,Guideline,"Scoping, Requirements",Reddit | r/sales thread,https://www.reddit.com/r/sales/comments/ca71u8/why_dont_salespeople_know_how_to_demo_software/,,,,,,,,,,GoogleSheets,Manual Import: my_insights.csv
Use in-app guides sparingly and time-based nudges for users who stall before key actions (48h).,Behavior-triggered nudges outperform generic drip campaigns for activation.,Self-serve activation sequences.,Efficiency,1,3,Guideline,Productivity; Enablement,Reddit | r/SaaS activation advice thread,https://www.reddit.com/r/SaaS/comments/1lv7wcw/seeking_advice_on_scaling_subscriptions_for_our/,Specific 48h follow-up window suggested.,,,,,,,,,GoogleSheets,Manual Import: my_insights.csv
"When raising prices, grandfather existing customers where possible; communicate early and often.",Reduces churn risk and backlash during pricing transitions.,Pricing/packaging changes on existing plans.,Risk,1,3,Guideline,Incentives; Communication,Reddit | r/SaaS + r/startups threads on grandfathering,https://www.reddit.com/r/SaaS/comments/1andect/price_increase_how_to_handle/,,,,,,,,,,GoogleSheets,Manual Import: my_insights.csv
"Book SteerCo invites with objectives, decisions needed, and pre-read link",Decision-centric agendas keep execs engaged.,Quarterly or monthly SteerCo meetings,Efficiency,5,3,Tactical,Planning,Reddit | r/projectmanagement – SteerCo invite best practices,https://www.reddit.com/r/projectmanagement/comments/yhlesi/steering_committee_invitation/,,,,,,,,,,GoogleSheets,Manual Import: my_insights.csv
"Status emails: 5 bullets max—progress, risks, decisions, next steps, asks","Short, scannable updates build trust.",Weekly cadence with busy sponsors,Risk,3,4,Guideline,Communication,Reddit | r/projectmanagement – status templates,https://www.reddit.com/r/projectmanagement/comments/1gp7y70/status_reporting_ppt_templates/,,,,,,,,,,GoogleSheets,Manual Import: my_insights.csv
"Draft SOW headers: Purpose, Deliverables, Assumptions, Out of Scope, Timeline, Fees",Make assumptions and OOS explicit to control risk.,First-time SOW writing,Risk,4,3,Guideline,Documentation,Reddit | r/projectmanagement – SOW thread,https://www.reddit.com/r/projectmanagement/comments/10rcrgk/being_asked_to_write_a_sow_for_the_first_time_and/,,,,,,,,,,GoogleSheets,Manual Import: my_insights.csv
Treat SOW assumptions as risk controls; read them aloud in kickoffs,Sets boundaries early; aids future change orders.,Protecting scope during initiation,Risk,2,3,Guideline,Safety,Reddit | r/projectmanagement – SOW thread,https://www.reddit.com/r/projectmanagement/comments/10rcrgk/being_asked_to_write_a_sow_for_the_first_time_and/,,,,,,,,,,GoogleSheets,Manual Import: my_insights.csv
Schedule SteerCo monthly; Ops cadence weekly; decision syncs on demand,"Separate status, execution, and decisions.",Governance rhythms,Efficiency,5,3,Guideline,Planning,Reddit | r/projectmanagement – governance threads,https://www.reddit.com/r/projectmanagement/comments/12kfxks/whats_the_difference_between_a_steerco_and_a/,,,,,,,,,,GoogleSheets,Manual Import: my_insights.csv
Pre-wire SteerCo decisions 1:1 with key execs before the meeting,No surprises in-room; get objections offline first.,Steering committee milestones and approvals,Efficiency,3,3,Guideline,Executive Alignment,Reddit | r/projectmanagement – 'difference between SteerCo and QBR' + r/consulting unspoken rules,https://www.reddit.com/r/projectmanagement/comments/12kfxks/whats_the_difference_between_a_steerco_and_a/,,,,,,,,,,GoogleSheets,Manual Import: my_insights.csv
Treat SOW assumptions as risk controls; read them aloud in kickoffs,Sets boundaries early and clarifies implicit assumptions; reduces scope creep and unowned risk downstream,Protecting scope during initiation,Risk,2,4,Guideline,Safety,Reddit | r/projectmanagement,https://www.reddit.com/r/projectmanagement/comments/nad83e/sow_scope_controls,Observed in cross-functional consulting teams to avoid risk ownership ambiguity during kickoff,,,,,,,,,GoogleSheets,Manual Import: my_insights.csv
"For exec decks, cut any slide that fails the 'so-what?' decision test.",Exec attention is scarce; every slide should drive a decision or outcome.,"Quarterly business reviews, board updates.",Efficiency,1,3,Tactical,Clarity; Executive Alignment,Reddit | r/ProductManagement presentation threads,https://www.reddit.com/r/ProductManagement/comments/kes0xe/how_to_give_an_effective_concise_presentation_to/,Slide-level 'so-what?' test widely recommended.,,,,,,,,,GoogleSheets,Manual Import: my_insights.csv
"For platform migrations, keep old path supported but ship net-new value only on the new path.",Carrots + support accelerate migration without forcing churn.,Sunsetting legacy systems while retaining customers.,Revenue,1,3,Guideline,Planning; Incentives,Reddit | r/ProductManagement legacy system thread,https://www.reddit.com/r/ProductManagement/comments/fnmy7t/seeking_advice_how_to_product_manage_a_legacy/,,,,,,,,,,GoogleSheets,Manual Import: my_insights.csv
"If you do run painted-door tests, clearly message intent and give users an opt-out path.",Transparent messaging preserves goodwill while measuring interest.,Lightweight demand tests in-product.,Efficiency,1,4,Guideline,Quality Assurance; Communication,Reddit | r/ProductManagement discussion on painted doors,https://www.reddit.com/r/ProductManagement/comments/rqmgy3/is_anyone_here_running_painted_door_tests/,,,,,,,,,,GoogleSheets,Manual Import: my_insights.csv
Keep a visible decision log and review it in exec forums to prevent 'executive amnesia'.,Making decisions 'sticky' avoids re-opening settled topics and protects timelines.,Programs with high leadership turnover or long timelines.,Efficiency,1,3,Guideline,Accountability; Documentation,Reddit | r/ProductManagement + r/projectmanagement decision-log threads,https://www.reddit.com/r/ProductManagement/comments/1evtr7g/dealing_with_executive_amnesia/,Use Confluence/RAID; pull it up live when decisions are made.,,,,,,,,,GoogleSheets,Manual Import: my_insights.csv
Create 'exec summary' first; build the deck from it,Ensures story stays decision-oriented.,Executive reads and pitches,Efficiency,3,3,Guideline,Clarity,Reddit | r/ProductManagement – storytelling,https://www.reddit.com/r/ProductManagement/,The header should tell the whole story linearly.,,,,,,,,,GoogleSheets,Manual Import: my_insights.csv
Capture raw quotes + timestamps; tag Theme/Insight/Evidence,Traceability prevents 'opinion wars'.,Turning interviews into artifacts,Efficiency,4,3,Tactical,Documentation,Reddit | r/ProductManagement – research ops threads,https://www.reddit.com/r/ProductManagement/,Link quotes to OST opportunities.,,,,,,,,,GoogleSheets,Manual Import: my_insights.csv
Share 'decision trees' for go/no-go with explicit thresholds,Avoids circular launch debates.,Cutover and risky migrations,Efficiency,3,3,Tactical,Clarity,Reddit | r/ProductManagement – launch checklists,https://www.reddit.com/r/ProductManagement/,Define thresholds per guardrail metric.,,,,,,,,,GoogleSheets,Manual Import: my_insights.csv
Pre-wire decisions 1:1 before SteerCo,Avoids surprises and in-room derailment.,Major roadmap or investment asks,Efficiency,3,4,cue,Executive Alignment,Reddit | r/ProductManagement – exec alignment threads,https://www.reddit.com/r/ProductManagement/,Validate objections and refine ask ahead of time.,,,,,,,,,GoogleSheets,Manual Import: my_insights.csv
"Use 'problem, options, recommendation' decision slides","Focuses execs on trade-offs, not storytelling.",SteerCo/exec asks,Efficiency,3,3,Guideline,Clarity,Reddit | r/ProductManagement – decision slide tips,https://www.reddit.com/r/ProductManagement/,List risks/mitigations with each option.,,,,,,,,,GoogleSheets,Manual Import: my_insights.csv
Translate tech constraints as 'user-visible risks' not jargon,Improves exec decisions; earns trust.,Explaining trade-offs to non-technical leaders,Risk,2,4,cue,Translation,Reddit | r/ProductManagement – comms tips,https://www.reddit.com/r/ProductManagement/,"E.g., 'risk: data corruption' > 'no ACID'.",,,,,,,,,GoogleSheets,Manual Import: my_insights.csv
Use backlog 'parking lot' for good ideas without derailing focus,Acknowledges input while protecting priorities.,Stakeholder requests and ideas,Efficiency,3,4,cue,Prioritization,Reddit | r/ProductManagement – backlog hygiene,https://www.reddit.com/r/ProductManagement/,Review monthly; don't pretend it's now.,,,,,,,,,GoogleSheets,Manual Import: my_insights.csv
"Use a weekly RAG one-pager: status trend, achievements, next 2–3 decisions","RAG + delta since last report keeps attention on change, not history.",Recurring project status to execs,Efficiency,4,3,Guideline,Documentation,Reddit | r/pmp – status report template thread,https://www.reddit.com/r/pmp/comments/wpdzi5/any_recommendations_for_project_status_report/,,,,,,,,,,GoogleSheets,Manual Import: my_insights.csv
Stand up weekly decision logs: what changed since last week only,Focus on delta; avoid history lessons.,Momentum in transformation programs,Efficiency,3,3,Guideline,Feedback Loops,Reddit | r/pmp – status guidance,https://www.reddit.com/r/pmp/comments/wpdzi5/any_recommendations_for_project_status_report/,,,,,,,,,,GoogleSheets,Manual Import: my_insights.csv
Rexroth IndraDrive: SD card may be mandatory—treat cards as critical spares.,Some generations store parameters only on SD; failure can brick a line until reloaded.,Maintaining servo systems with IndraDrive.,Efficiency,1,2,warning,"Risk Triage, Escalation","Reddit | r/PLC — ""Wish me luck guys…"" (IndraDrive SD card experience",https://www.reddit.com/r/PLC/comments/1gw778u/wish_me_luck_guys/,Consider PLC‑level parameter backup functions where available.,,,,,,,,,GoogleSheets,Manual Import: my_insights.csv
"Land field wires on terminal blocks, not directly on I/O cards, to preserve maintainability.",TBs are robust/cheap and let field crews work without touching fragile I/O; enables future upgrades.,Panel design for new cells or retrofits.,Efficiency,5,3,Guideline,"Enablement, Documentation","Reddit | r/PLC — ""Wiring to terminal blocks vs IO card""",https://www.reddit.com/r/PLC/comments/1chubgh/wiring_to_terminal_blocks_vs_io_card/,UL field‑wiring ratings and noise on high‑speed I/O are noted in the thread.,,,,,,,,,GoogleSheets,Manual Import: my_insights.csv
4–20 mA loops: ground cable shield at ONE end only (usually the source) to avoid ground loops.,Prevents noise currents on shields that distort small analog signals.,Installing transmitters/analog sensors in noisy environments.,Efficiency,3,3,Guideline,"Data Hygiene, Quality Assurance","Reddit | r/PLC — ""Why most analog inputs are 4‑20 mA instead of 0–10 V?"" (top comment",https://www.reddit.com/r/PLC/comments/1b4my5j/why_most_of_the_analog_inputs_are_420_ma_instead/,One‑end shield ground is a common rule for low‑level signals to break ground loops.,,,,,,,,,GoogleSheets,Manual Import: my_insights.csv
Modbus 'off‑by‑one': some devices are 0‑based and some are 1‑based—subtract/add 1 accordingly.,Prevents addressing errors when maps say 40001 vs. 40000; avoids reading wrong registers.,Integrating HMIs/meters with PLCs via Modbus RTU/TCP.,Efficiency,2,3,Guideline,"Clarity, Translation","Reddit | r/PLC — ""Why do I need to deduct 1 from Modbus register addresses?""",https://www.reddit.com/r/PLC/comments/rfllc6/why_do_i_need_to_deduct_1_from_modbus_register/,Also see explainer threads on 0x/1x/3x/4x spaces.,,,,,,,,,GoogleSheets,Manual Import: my_insights.csv
RS‑485 triage: temporarily segment the tr and move the terminator to isolate a noisy device.,Halving the network narrows the suspect set quickly; relocation checks reflections.,Intermittent comms on long RS‑485 daisy chains.,Efficiency,1,3,Tactical,"Workaround, Testing","Reddit | r/PLC — ""Troubleshooting ideas for RS‑485 4‑wire daisy chain""",https://www.reddit.com/r/PLC/comments/t5dfqc/looking_for_troubleshooting_ideas_for_rs485_4wire/,Keep stubs short; change one thing at a time.,,,,,,,,,GoogleSheets,Manual Import: my_insights.csv
Use ferrules on stranded conductors in screw/spring clamp terminals.,Prevents strand cut‑through and loosening; improves long‑term reliability.,"Panel wiring and device terminations (relay bases, terminal blocks).",Efficiency,5,3,Guideline,"Quality Assurance, Data Hygiene","Reddit | r/PLC — ""To ferrule, or not to ferrule""",https://www.reddit.com/r/PLC/comments/eh7uxa/to_ferrule_or_not_to_ferrule_that_is_the_question/,Correct ferrule sizing and crimper type matter more than brand.,,,,,,,,,GoogleSheets,Manual Import: my_insights.csv
"Structure your program by I/O module: read, sanitize (scale/debounce), then process; keep it consistent.",Predictable structure speeds debug and onboarding; reduces hidden side effects.,Refactoring messy PLC programs or moving to ST.,Retention,5,4,Guideline,"Enablement, Documentation","Reddit | r/PLC — ""Struggling with moving from ladder to ST"" (advice",https://www.reddit.com/r/PLC/comments/1eecvc9/struggling_a_lot_with_moving_from_ladder_to_st/,Common pattern: IO pick‑up → Conditioning → Processing → Outputs.,,,,,,,,,GoogleSheets,Manual Import: my_insights.csv
RS‑485: Measure ~60 Ω end‑to‑end to confirm proper 120 Ω terminations at both ends.,Quick verification that two 120 Ω terminators are present; catches missing/extra terminators.,Field troubleshooting of multi‑drop Modbus/RS‑485 networks.,Efficiency,4,3,Tactical,"Testing, Data Hygiene","Reddit | r/PLC — ""RS485 communication"" (top advice",https://www.reddit.com/r/PLC/comments/1dztt38/rs485_communication/,If three terminators are present expect ~40 Ω; zero/OL indicates wiring issues.,,,,,,,,,GoogleSheets,Manual Import: my_insights.csv
