description,rationale,use_case,impact_area,transferability_score,actionability_rating,type_(form),tag_(application),source_(interview_#/_name),link,notes,evidence_strength,unique?,role,function,company,industry,country,date,source,filepath
Use alternative features when main ones are deprecated or buggy,"In software development, features can sometimes be deprecated or contain bugs that hinder their functionality. By using alternative features, you can bypass these issues and maintain productivity.","Software development, bug workaround",Efficiency,4,4,workaround,Bug Resolution,github/mzeitlin11,https://github.com/pandas-dev/pandas/issues/41930#issuecomment-872571665,repo: pandas-dev/pandas | issue: BUG: pd.Grouper cannot be reused in some cases  | keyword: workaround,,,,,,,,,GoogleSheets,Manual Import: my_insights.csv
"Use ``` pandas.set_option('future.no_silent_downcasting', True) ``` to retain object dtype in pandas 3.0","This setting prevents automatic downcasting to int64, allowing you to maintain the original data type of your pandas series. It's a workaround to a change in pandas 3.0 that may not be desirable for all use cases.",Retaining object dtype in pandas,Efficiency,4,5,workaround,Data Management,github/phofl,https://github.com/pandas-dev/pandas/issues/57734#issuecomment-1981871396,repo: pandas-dev/pandas | issue: QST: How to solve pandas (2.2.0) 'FutureWarning: Downcasting behavior in `replace` is deprecated' on a Series? | keyword: workaround,,,,,,,,,GoogleSheets,Manual Import: my_insights.csv
Use 'map' function instead of 'replace' for casting categorical variables in pandas,"The 'replace' function in pandas was previously casting your dtypes, but it will stop doing so in future versions. Using the 'map' function instead allows you to maintain control over dtype casting, making your code more future-proof and less prone to unexpected behavior.",Casting categorical variables in pandas,Efficiency,4,5,workaround,Data Processing,github/buhtz,https://github.com/pandas-dev/pandas/issues/57734#issuecomment-1994220779,repo: pandas-dev/pandas | issue: QST: How to solve pandas (2.2.0) 'FutureWarning: Downcasting behavior in `replace` is deprecated' on a Series? | keyword: workaround,,,,,,,,,GoogleSheets,Manual Import: my_insights.csv
Use pandas Categorical codes to convert string data into integer format instead of using .replace,"This workaround is effective because pandas Categorical codes provide a way to encode string data as integers, which can be useful when working with machine learning algorithms that require numerical input. This method avoids the FutureWarning associated with downcasting behavior in .replace.",Converting string data to integers,Efficiency,4,4,workaround,Data Preprocessing,github/jerome-white,https://github.com/pandas-dev/pandas/issues/57734#issuecomment-1994448905,repo: pandas-dev/pandas | issue: QST: How to solve pandas (2.2.0) 'FutureWarning: Downcasting behavior in `replace` is deprecated' on a Series? | keyword: workaround,,,,,,,,,GoogleSheets,Manual Import: my_insights.csv
Use 'pd.option_context' when dealing with NA values in pandas dataframes to avoid FutureWarning,"The 'pd.option_context' allows for temporary setting of pandas options within a context, which can help in dealing with NA values in dataframes without triggering a FutureWarning. This is a workaround for the deprecated downcasting behavior in 'replace' on a Series.",Handling NA values in pandas,Efficiency,4,5,workaround,Data Cleaning,github/daviewales,https://github.com/pandas-dev/pandas/issues/57734#issuecomment-2274836151,repo: pandas-dev/pandas | issue: QST: How to solve pandas (2.2.0) 'FutureWarning: Downcasting behavior in `replace` is deprecated' on a Series? | keyword: workaround,,,,,,,,,GoogleSheets,Manual Import: my_insights.csv
Use map() instead of replace() when needing to change dtypes and handle null values in pandas.,"The map() function allows for more granular control and avoids warnings that can occur with the replace() function. It can handle both dtype conversion and null value management in a single operation, improving code readability and efficiency.","Changing dtypes, handling null values",Efficiency,4,5,workaround,Data Cleaning,github/SamLovesHoneyWater,https://github.com/pandas-dev/pandas/issues/57734#issuecomment-2574215022,repo: pandas-dev/pandas | issue: QST: How to solve pandas (2.2.0) 'FutureWarning: Downcasting behavior in `replace` is deprecated' on a Series? | keyword: workaround,,,,,,,,,GoogleSheets,Manual Import: my_insights.csv
"Use 'pandas.set_option(""future_no_silent_downcasting"", True)' to retain object dtype in pandas 3.0 instead of casting to int64","This workaround prevents automatic downcasting in pandas 3.0, which could lead to data loss or incorrect data types. It's a proactive measure to ensure data integrity when upgrading pandas.",Preventing automatic downcasting in pandas,Risk,4,5,workaround,Data Integrity,github/randomseed42,https://github.com/pandas-dev/pandas/issues/57734#issuecomment-3182838142,repo: pandas-dev/pandas | issue: QST: How to solve pandas (2.2.0) 'FutureWarning: Downcasting behavior in `replace` is deprecated' on a Series? | keyword: workaround,,,,,,,,,GoogleSheets,Manual Import: my_insights.csv
Use the 'bool_fillna_inplace' function as a workaround for replacing NaN/None with False in pandas series.,The pandas library sometimes has issues handling NaN/None values in boolean series. This workaround provides a way to handle these values and ensure the series remains boolean.,Handling NaN/None in boolean series,Efficiency,3,4,workaround,Data Cleaning,github/joaoe,https://github.com/pandas-dev/pandas/issues/59831#issuecomment-2500704786,repo: pandas-dev/pandas | issue: ENH: Restore the functionality of `.fillna` | keyword: workaround,,,,,,,,,GoogleSheets,Manual Import: my_insights.csv
Use different regex libraries for different tasks when necessary.,Different regex libraries may have different strengths and weaknesses. Using the right one for the task can improve efficiency and results.,Handling regex in different libraries,Efficiency,3,4,workaround,Code Efficiency,github/TomAugspurger,https://github.com/pandas-dev/pandas/issues/22496#issuecomment-515518510,repo: pandas-dev/pandas | issue: Add support for 'regex' library | keyword: gotcha,,,,,,,,,GoogleSheets,Manual Import: my_insights.csv
Use re2 library with the apply method for faster regular expressions in pandas.,"The apply method is typically slow, but the execution time of re2 is significantly faster, making this combination more efficient for handling regular expressions in pandas.",Speeding up regular expressions in pandas,Efficiency,4,4,workaround,Data Processing,github/ptth222,https://github.com/pandas-dev/pandas/issues/22496#issuecomment-2698608729,repo: pandas-dev/pandas | issue: Add support for 'regex' library | keyword: gotcha,,,,,,,,,GoogleSheets,Manual Import: my_insights.csv
Use `memory_usage(deep=True)` instead of nbytes for accurate memory usage in Pandas,"The nbytes method may provide misleading information about memory usage, especially for object data types. The `memory_usage(deep=True)` method provides a more accurate estimate.",Estimating memory usage in Pandas,Efficiency,4,5,workaround,Data Analysis,github/tehunter,https://github.com/pandas-dev/pandas/issues/48438,repo: pandas-dev/pandas | keyword: gotcha | state: open,,,,,,,,,GoogleSheets,Manual Import: my_insights.csv
Use `astype(bytes)` with caution in pandas to avoid data loss,"The pandas library's `astype(bytes)` function can lead to data loss when roundtripping data through pandas dataframes. This is due to the function's default behavior, which may not preserve all data types correctly. It's better to use a more specific function or method that guarantees data preservation.",Data roundtripping in pandas,Risk,3,4,warning,Data Management,github/WillAyd,https://github.com/pandas-dev/pandas/issues/58205#issuecomment-2053676181,repo: pandas-dev/pandas | issue: BUG: Roundtripping bytes through pandas dataframes leads to data loss | keyword: gotcha,,,,,,,,,GoogleSheets,Manual Import: my_insights.csv
Use `__iter__` to iterate over the index in Series and DataFrames.,Both Series and DataFrames are data structures with a well-defined order. Users expect to be able to iterate over them. Using `__iter__` to iterate over the index aligns with this expectation and the dictionary-analogy of Series.,Iterating over Series and DataFrames,Efficiency,4,5,workaround,Data Management,github/rhshadrach,https://github.com/pandas-dev/pandas/issues/14235#issuecomment-1629652870,repo: pandas-dev/pandas | issue: BUG: Python operator 'in' behaves in two different ways on Series object | keyword: gotcha,,,,,,,,,GoogleSheets,Manual Import: my_insights.csv
Use BytesIO and gzip for in-memory data compression when saving to disk is not ideal,"This method allows for data compression without relying on the end user's local environment, making it more portable and less dependent on specific system configurations.",In-memory data compression,Efficiency,4,4,workaround,Data Management,github/ZaxR,https://github.com/pandas-dev/pandas/issues/22555#issuecomment-418958420,repo: pandas-dev/pandas | issue: In-memory to_csv compression | keyword: gotcha,,,,,,,,,GoogleSheets,Manual Import: my_insights.csv
Use tuples instead of lists for single labels of a MultiIndex in pandas to avoid confusion.,"In pandas, tuples are used to indicate labels of a MultiIndex. Using a list in this case can cause confusion and errors, as it becomes difficult to distinguish between the different levels of the MultiIndex.",Labeling MultiIndex in pandas,Efficiency,3,4,workaround,Data Management,github/jorisvandenbossche,https://github.com/pandas-dev/pandas/issues/16943#issuecomment-362248941,repo: pandas-dev/pandas | issue: MultiIndex row indexing with .loc fail with tuple but work with list of indices | keyword: gotcha,,,,,,,,,GoogleSheets,Manual Import: my_insights.csv
Use global constants or environment variables to handle future changes in dependencies.,This approach allows you to prepare your code for future changes in dependencies without duplicating tests or code. It provides flexibility and maintainability as you can adjust the global constant or environment variable when the dependency update is released.,Preparing code for dependency updates,Efficiency,4,4,workaround,Code Maintenance,github/cdcadman,https://github.com/pandas-dev/pandas/pull/48576#issuecomment-1256713833,repo: pandas-dev/pandas | issue: Make pandas/io/sql.py work with sqlalchemy 2.0 | keyword: gotcha,,,,,,,,,GoogleSheets,Manual Import: my_insights.csv
Avoid changing the return type of a documented function in a public API unless necessary.,Changing the return type of a function in a public API can break existing code that depends on the original return type. This can lead to unexpected issues for users of the API and increase maintenance overhead.,Modifying public API functions,Risk,4,5,rule-of-thumb,Code Maintenance,github/cdcadman,https://github.com/pandas-dev/pandas/pull/48576#issuecomment-1294907916,repo: pandas-dev/pandas | issue: Make pandas/io/sql.py work with sqlalchemy 2.0 | keyword: gotcha,,,,,,,,,GoogleSheets,Manual Import: my_insights.csv
Use breakpoint() instead of ValueError to track down call arguments,"Using breakpoint() allows you to pause program execution at a certain point and inspect variables, which can be more effective than ValueError for debugging. ValueError only provides an error message, while breakpoint() allows you to interactively explore the state of the program.",Debugging complex software,Efficiency,4,4,workaround,Debugging,github/jbrockmendel,https://github.com/pandas-dev/pandas/issues/39585#issuecomment-775555273,repo: pandas-dev/pandas | issue: Intermittent error fetching value from multi-indexed dataframe | keyword: gotcha,,,,,,,,,GoogleSheets,Manual Import: my_insights.csv
Use a minimally invasive approach to fix bugs by checking for extreme values before scaling.,"This approach avoids introducing unnecessary changes into the codebase, reducing the risk of causing other issues. It also makes the code easier to understand and maintain.",Fixing bugs in numerical calculations,Efficiency,4,4,workaround,Bug Fixing,github/robert-schmidtke,https://github.com/pandas-dev/pandas/pull/57314#issuecomment-1948430840,repo: pandas-dev/pandas | issue: BUG: Fix near-minimum timestamp handling | keyword: gotcha,,,,,,,,,GoogleSheets,Manual Import: my_insights.csv
Prioritize open-source contributions to reduce overall workload,"Contributing to open-source projects, even if it seems like additional work, can ultimately reduce your overall workload. This is because the improvements you make can be utilized by others, reducing the need for duplicate efforts and fostering a collaborative environment where others can also contribute to your projects.",Open-source project management,Efficiency,4,4,rule-of-thumb,Collaboration,github/KOLANICH,https://github.com/pandas-dev/pandas/issues/44453#issuecomment-1055636670,repo: pandas-dev/pandas | issue: BLD: remove support for 32 bit | keyword: pro tip,,,,,,,,,GoogleSheets,Manual Import: my_insights.csv
Use 'containerRestarting' instead of 'containerRestarted' as an event reason in Kubernetes.,The 'containerRestarting' event reason provides a more accurate representation of the situation where a container restart fails once or twice before successfully starting. It reduces confusion and overlap with 'containerStarted' and 'containerDied' events.,Managing container events in Kubernetes,Efficiency,4,5,workaround,Code Management,github/Ritikaa96,https://github.com/kubernetes/kubernetes/pull/126474#issuecomment-2635725354,repo: kubernetes/kubernetes | issue: publish an event when the container is restarted | keyword: best practice,,,,,,,,,GoogleSheets,Manual Import: my_insights.csv
Use specific annotation prefixes in Kubernetes to control node autoscaling,"Using specific annotation prefixes allows for more granular control over node autoscaling. It differentiates between pods not safe to evict by autoscalers and those not safe to evict by any standard draining mechanism, enabling more efficient resource management.",Managing Kubernetes node autoscaling,Efficiency,4,4,rule-of-thumb,Resource Management,github/MaciekPytel,https://github.com/kubernetes/kubernetes/pull/124800#issuecomment-2218288529,repo: kubernetes/kubernetes | issue: Define a common Node autoscaling safe-to-evict/do-not-disrupt annotation | keyword: best practice,,,,,,,,,GoogleSheets,Manual Import: my_insights.csv
Prioritize error tracking even during debug information collection,Errors during the debug information collection process can provide valuable insights into the root cause of issues. Ignoring these can lead to missed opportunities for problem resolution.,Debugging software issues,Efficiency,4,4,rule-of-thumb,Error Management,github/aojea,https://github.com/kubernetes/kubernetes/issues/128655#issuecomment-2462702572,repo: kubernetes/kubernetes | issue: Failure cluster [245f6915...]: Networking Granular Checks: Services should update endpoints: http | keyword: lesson learned,,,,,,,,,GoogleSheets,Manual Import: my_insights.csv
Use `forbidigo` to prevent new usage of unwanted dependencies instead of rewriting them.,"`forbidigo` is a linter that forbids certain identifiers. By using it, you can prevent new usages of unwanted dependencies, which is more efficient than rewriting existing ones. This approach allows you to maintain control over your codebase and ensure that unwanted dependencies do not proliferate.",Managing unwanted code dependencies,Efficiency,4,4,workaround,Code Management,github/BenTheElder,https://github.com/kubernetes/kubernetes/issues/129652#issuecomment-3186234245,repo: kubernetes/kubernetes | issue: Remove the MD5 hash function for FIPS compliance | keyword: workaround,,,,,,,,,GoogleSheets,Manual Import: my_insights.csv
Use a local caching proxy as a point of failure instead of the remote registry,"By making the local caching proxy the point of failure, you can mitigate the risk of remote registry unavailability affecting your operations. This is especially useful when dealing with mutable tags that may not be supported by the remote registry.",Mitigating remote registry unavailability,Risk,4,3,workaround,Risk Management,github/Alibirb,https://github.com/kubernetes/kubernetes/issues/111822#issuecomment-1800277335,repo: kubernetes/kubernetes | issue: imagePullPolicy to pull latest image OR use existing image if repository unavailable | keyword: workaround,,,,,,,,,GoogleSheets,Manual Import: my_insights.csv
Use Multi-Process Service (MPS) to allow multiple processes to share a single GPU.,"By default, kernels from different processes can't run on one GPU simultaneously. They are time sliced. The Pascal architecture brings instruction-level preemption instead of block-level preemption, but context switches are not free. Also, there is no way of partitioning GPU resources (SMs, memory), or even assigning priorities when sharing a card. MPS allows for better resource allocation and management.",Sharing GPU to multiple containers,Efficiency,3,4,workaround,Resource Management,github/RenaudWasTaken,https://github.com/kubernetes/kubernetes/issues/52757#issuecomment-330766518,repo: kubernetes/kubernetes | issue: Is sharing GPU to multiple containers feasible? | keyword: workaround,,,,,,,,,GoogleSheets,Manual Import: my_insights.csv
"Create a new 'availability zone' with desired storage characteristics, migrate data, then destroy the old zone when dealing with limitations on elasticsearch.","This workaround allows for changes in storage characteristics without running into issues with EBS volumes being unable to be assigned due to being in the wrong availability zone. By creating a new 'availability zone' with the desired characteristics, data can be migrated smoothly without disruption.",Elasticsearch storage characteristic changes,Efficiency,4,4,workaround,Data Management,github/DaveWHarvey,https://github.com/kubernetes/kubernetes/issues/68737#issuecomment-466514840,repo: kubernetes/kubernetes | issue: StatefulSet: support resize pvc storage in K8s v1.11 | keyword: workaround,,,,,,,,,GoogleSheets,Manual Import: my_insights.csv
Use built-in immutability validation for root resources to avoid sub-par validation issues.,"This tactic works because built-in immutability validation provides a more robust validation mechanism for root resources, reducing the likelihood of errors and improving the overall quality of the data.",Improving data validation in root resources,Efficiency,4,4,workaround,Data Validation,github/jpbetz,https://github.com/kubernetes/kubernetes/issues/122163#issuecomment-1907223578,repo: kubernetes/kubernetes | issue: Consider allowing CEL validation of metadata.namespace field of embedded resource | keyword: workaround,,,,,,,,,GoogleSheets,Manual Import: my_insights.csv
Use a combination of Kubernetes' PodDisruptionBudget (PDB) and Horizontal Pod Autoscaler (HPA) to maintain minimum pod availability during node drains.,"By setting a PDB, you can ensure a minimum number of pods are always available. However, during a `kubectl drain`, you may hit the PDB limit and be unable to evict further pods. By also using an HPA, you can automatically scale up your pods before the drain, ensuring you have enough pods to maintain your service while staying within the PDB limits.",Maintaining service during Kubernetes node drains,Efficiency,3,4,workaround,Service Availability,github/ldemailly,https://github.com/kubernetes/kubernetes/issues/93476#issuecomment-1258433810,repo: kubernetes/kubernetes | issue: Allow scaling up to meet PDB constraints | keyword: workaround,,,,,,,,,GoogleSheets,Manual Import: my_insights.csv
"Avoid changing the secret type in Kubernetes environment variables directly. Instead, create a new variable with the desired secret type.","Changing the secret type of an existing environment variable can lead to invalid configurations, as Kubernetes does not allow a variable to have both a 'value' and a 'valueFrom' field. Creating a new variable avoids this conflict.",Managing environment variables in Kubernetes,Efficiency,4,5,workaround,DevOps,github/Thematrixme,https://github.com/kubernetes/kubernetes/issues/46861#issuecomment-617838488,"repo: kubernetes/kubernetes | issue: ENV invalid: spec.template.spec.containers[0].env[14].valueFrom: Invalid value: """": may not be specified when `value` is not empty | keyword: workaround",,,,,,,,,GoogleSheets,Manual Import: my_insights.csv
Use `kubectl edit <DEPLOYMENT>` to remove literally defined Environment vars before applying new deployment with secret-defined vars.,The Kubernetes deployment fails when Environment vars are defined both literally and in the secret. Removing the literal definitions before applying the new deployment resolves the conflict.,Resolving Kubernetes deployment failure,Efficiency,4,4,workaround,Deployment Management,github/MortezaHosseini,https://github.com/kubernetes/kubernetes/issues/46861#issuecomment-643101281,"repo: kubernetes/kubernetes | issue: ENV invalid: spec.template.spec.containers[0].env[14].valueFrom: Invalid value: """": may not be specified when `value` is not empty | keyword: workaround",,,,,,,,,GoogleSheets,Manual Import: my_insights.csv
Avoid using 'kubectl apply' after 'kubectl create' for the same Kubernetes resource,"The data structures for 'kubectl create' and 'kubectl apply' are slightly different, which can cause conflicts when updating resources. Instead, use 'kubectl replace' or 'kubectl edit' to update resources created with 'kubectl create'.",Updating Kubernetes resources,Efficiency,4,5,workaround,DevOps,github/immortalize,https://github.com/kubernetes/kubernetes/issues/46861#issuecomment-703858205,"repo: kubernetes/kubernetes | issue: ENV invalid: spec.template.spec.containers[0].env[14].valueFrom: Invalid value: """": may not be specified when `value` is not empty | keyword: workaround",,,,,,,,,GoogleSheets,Manual Import: my_insights.csv
Prioritize network adequacy when troubleshooting service mesh issues.,"The network is often overlooked, but it's a common denominator in many setups and can be the root cause of service mesh issues. Providers like DO or Google Cloud rarely have these issues, indicating a strong network is key.",Troubleshooting service mesh issues,Efficiency,4,4,workaround,Network Troubleshooting,github/gridworkz,https://github.com/kubernetes/kubernetes/issues/61117#issuecomment-830231248,repo: kubernetes/kubernetes | issue: PLEG is not healthy | keyword: workaround,,,,,,,,,GoogleSheets,Manual Import: my_insights.csv
"Create a new chain linking services chain to service-ports chain if destination address matches any of cluster, loadbalancer, or external IP, then add a rule to match on service port verdict map in this new chain and reject if nothing matches.","This approach allows for more granular control over service IP port connections, reducing the risk of unauthorized access through invalid ports. By creating a separate chain for service ports and setting specific rules, you can ensure that only valid connections are accepted.",Managing Kubernetes service IP connections,Risk,4,3,workaround,Network Security,github/aroradaman,https://github.com/kubernetes/kubernetes/issues/122572#issuecomment-1884474235,repo: kubernetes/kubernetes | issue: nftables kube-proxy TODO | keyword: workaround,,,,,,,,,GoogleSheets,Manual Import: my_insights.csv
Prioritize object-versioning over resource-versioning in cross-object ordering,"Object-versioning allows for more precise control and predictability in cross-object ordering scenarios. It ensures that you wait for a specific object to reach a certain version, rather than waiting for any object to reach a certain resource version. This reduces the risk of unexpected behavior or errors.",Cross-object ordering in coding,Efficiency,4,4,workaround,Coding Efficiency,github/lavalamp,https://github.com/kubernetes/kubernetes/issues/112684#issuecomment-1255537283,repo: kubernetes/kubernetes | issue: RV vs object-wide logical clock | keyword: gotcha,,,,,,,,,GoogleSheets,Manual Import: my_insights.csv
Avoid overcomplicating solutions with unnecessary steps and modifications.,"Simpler solutions are easier to implement, maintain, and troubleshoot. Overcomplicated solutions can introduce unnecessary complexity and potential points of failure.",Developing software features,Efficiency,4,4,rule-of-thumb,Software Development,github/thockin,https://github.com/kubernetes/kubernetes/issues/24957#issuecomment-215940195,repo: kubernetes/kubernetes | issue: Feature request: A way to signal pods | keyword: gotcha,,,,,,,,,GoogleSheets,Manual Import: my_insights.csv
Avoid overlapping concepts in product development to increase efficiency.,"Overlapping concepts can lead to confusion, redundancy, and wasted resources. By focusing on a single, comprehensive solution, you can streamline the development process and create a more cohesive product.",Product development and design,Efficiency,4,4,rule-of-thumb,Product Development,github/bprashanth,https://github.com/kubernetes/kubernetes/issues/24957#issuecomment-215940594,repo: kubernetes/kubernetes | issue: Feature request: A way to signal pods | keyword: gotcha,,,,,,,,,GoogleSheets,Manual Import: my_insights.csv
