description,rationale,use_case,impact_area,transferability_score,actionability_rating,type_(form),tag_(application),source_(interview_#/_name),link,notes,evidence_strength,unique?,role,function,company,industry,country,date,source,filepath
PowerPoint speed keys: Align/Distribute via Alt sequence and Selection Pane naming,Name objects; use Align/Distribute; Selection Pane controls visibility and order.,Rapid layout and clean layer naming for complex pages,Efficiency,1,3,Tactical,"Productivity, Feature Design",Microsoft Support – Selection Pane,https://support.microsoft.com/office/using-the-selection-pane-4f3c3d42-28b8-4b8e-b6f4-71d1d8f0d1f3,,,,,,,,,,GoogleSheets,Manual Import: my_insights.csv
Use section breaks for custom page numbers per appendix,Keeps things easy to read,Keep main deck clean while numbering appendices,Efficiency,1,3,Tactical,"Feature Design, Documentation",Microsoft Support – Section breaks,,,,,,,,,,,GoogleSheets,Manual Import: my_insights.csv
"Outline View first: write every slide title as a narrative, then build visuals","If titles alone don't tell the story, execs won't track; Outline View exposes gaps fast.",Decks for SteerCo/executive readouts,Efficiency,3,4,Guideline,Clarity,Microsoft Support – Outline View,https://support.microsoft.com/office/create-and-print-a-presentation-in-outline-view-eebf7c9a-5df1-4d2b-95f4-4f3a34b5b9f2,Draft titles top-to-bottom before adding content.,,,,,,,,,GoogleSheets,Manual Import: my_insights.csv
"Use Power Query for cleaning: split columns, trim, dedupe, enforce types",Record steps once; refresh as data updates.,Repeatable data prep pipelines in Excel,Efficiency,4,4,Guideline,"Data Hygiene, Productivity",Microsoft Support – Get & Transform (Power Query,https://support.microsoft.com/office/get-transform-in-excel-2016-8a18a8f3-5b9a-48c5-b7b6-0641f5d66b4b,,,,,,,,,,GoogleSheets,Manual Import: my_insights.csv
Convert ranges to Tables before modeling; reference with structured columns,"Tables carry names, styles, slicers, and expand with data.",Safer formulas that auto-extend,Efficiency,4,3,Guideline,"Data Hygiene, Productivity",Microsoft Support – Excel Tables,https://support.microsoft.com/office/create-and-format-tables-2943e6f8-9f52-4d6f-a548-71a3a4924a20,,,,,,,,,,GoogleSheets,Manual Import: my_insights.csv
"Dynamic arrays (FILTER, UNIQUE, SORT) to build live exhibits",Spill formulas keep lists and pivots synced.,Interactive one-pagers without manual copy/paste,Efficiency,1,3,Tactical,"Quality Assurance, Productivity",Microsoft Support – Dynamic arrays,https://support.microsoft.com/office/dynamic-array-formulas-2f8b7cb7-4336-4a6b-8f99-2f3c6f9b4e7c,,,,,,,,,,GoogleSheets,Manual Import: my_insights.csv
Use Track Changes and Compare to manage contract/SOW redlines,"Keeps a clean, reviewable history of changes.",Legal/procurement back-and-forth,Efficiency,1,3,Tactical,"Documentation, Negotiation",Microsoft Support – Compare documents,https://support.microsoft.com/office/compare-documents-using-the-legal-blackline-option-1e90842f-2628-4ed1-8f5b-9f827b0d17ff,,,,,,,,,,GoogleSheets,Manual Import: my_insights.csv
Prefer 'Cache-Aside' for read-heavy DB patterns; invalidate on write,App loads into cache on miss; evict on write.,Keep caches coherent with minimal complexity,Efficiency,1,3,Guideline,"Pattern Recognition, Quality Assurance",Microsoft Cloud Design Patterns,https://learn.microsoft.com/azure/architecture/patterns/cache-aside,,,,,,,,,,GoogleSheets,Manual Import: my_insights.csv
Use bulkheads: isolate thread/connection pools by downstream dependency,Separate pools per dependency with timeouts.,Prevent one failing dependency from starving everything,Efficiency,1,3,Guideline,"Performance Bottlenecks, Safety",Microsoft Cloud Design Patterns,https://learn.microsoft.com/azure/architecture/patterns/bulkhead,,,,,,,,,,GoogleSheets,Manual Import: my_insights.csv
Use XLOOKUP + structured tables instead of VLOOKUP on ranges,Fewer brittle formulas; auto-expands with data.,Working with evolving datasets,Efficiency,3,3,Guideline,Data Hygiene,Microsoft – XLOOKUP,https://support.microsoft.com/office/xlookup-function-78a5d9fd-7a29-4b9c-b6ec-0a6b274e7205,Exact match by default; handles left/right.,,,,,,,,,GoogleSheets,Manual Import: my_insights.csv
Footer shows file name + version on every printed deck,People can trace stray printouts.,Printed SteerCo binders,Efficiency,4,3,Tactical,Documentation,Microsoft – slide numbers/footers,https://support.microsoft.com/office/add-slide-numbers-2db6c292-4b4a-4a90-b3bf-f40f2e7444ba,Helps reconcile feedback to file.,,,,,,,,,GoogleSheets,Manual Import: my_insights.csv
Use Slide Master to lock grids/margins; only content placeholders on child layouts,Prevents alignment drift and rework across big decks.,Large decks with multiple editors,Efficiency,2,3,Guideline,Enablement,Microsoft – Slide Master,https://support.microsoft.com/office/use-slide-masters-to-customize-a-presentation-3d9c08b7-7c54-4c2a-8e1f-88eae3df7d8f,Enforce header/body/footer positions.,,,,,,,,,GoogleSheets,Manual Import: my_insights.csv
Selection Pane trick: layer clickable storyboards without new tools,Clickable flows in PPT avoid tool-switching.,Prototype UX without Figma,Efficiency,2,3,Tactical,Feature Design,Microsoft – Selection Pane,https://support.microsoft.com/office/using-the-selection-pane-4f3c3d42-28b8-4b8e-b6f4-71d1d8f0d1f3,Hide/show layers per click path.,,,,,,,,,GoogleSheets,Manual Import: my_insights.csv
Export PDF with embedded fonts + downsampled images,Avoids missing fonts and huge file sizes on client laptops.,Deliverables to procurement/boards,Efficiency,3,3,Guideline,Data Hygiene,Microsoft – Save as PDF,https://support.microsoft.com/office/save-or-convert-to-pdf-4b85b9a9-12b0-4d58-9f86-9aa0e26a2544,Check 'ISO 19005-1 compliant (PDF/A)'.,,,,,,,,,GoogleSheets,Manual Import: my_insights.csv
Lock sheets and protect workbook structure on client-facing models,Prevents accidental edits and formula loss.,Sharing Excel models,Efficiency,2,3,Tactical,Safety,Microsoft – Protect sheet/workbook,https://support.microsoft.com/office/protect-a-worksheet-3179efdb-64b5-4c0d-9d3f-2ab6363e0ae3,Unlock inputs only.,,,,,,,,,GoogleSheets,Manual Import: my_insights.csv
Use Presenter View; rehearse with timer and next-slide preview,Reduces slide reading and over-runs.,High-stakes presentations,Efficiency,2,3,Tactical,Enablement,Microsoft – Presenter View,https://support.microsoft.com/office/start-the-presentation-and-see-your-notes-in-presenter-view-4e07f0b3-00b4-4ea0-bc3b-f7fc1de8423a,Dual-screen recommended.,,,,,,,,,GoogleSheets,Manual Import: my_insights.csv
Power Query your data cleaning steps and click Refresh weekly,Repeatable ETL beats manual edits.,Weekly KPI packs / ops reports,Efficiency,1,4,Guideline,Productivity,Microsoft – Get & Transform,https://support.microsoft.com/office/get-transform-in-excel-2016-8a18a8f3-5b9a-48c5-b7b6-0641f5d66b4b,Record split/trim/dedupe/type steps.,,,,,,,,,GoogleSheets,Manual Import: my_insights.csv
Use Dynamic Arrays (FILTER/UNIQUE/SORT) to build live exhibits,Eliminates copy/paste and stale numbers.,One-pagers that must stay current,Efficiency,2,3,Tactical,Quality Assurance,Microsoft – Dynamic arrays,https://support.microsoft.com/office/dynamic-array-formulas-2f8b7cb7-4336-4a6b-8f99-2f3c6f9b4e7c,Spill ranges stay synced with source.,,,,,,,,,GoogleSheets,Manual Import: my_insights.csv
Conditional formatting for RAG and deltas in summary tables,Faster scan for executives.,Status one-pagers,Efficiency,2,3,Tactical,Feature Design,Microsoft – Conditional formatting,https://support.microsoft.com/office/conditional-formatting-106f4d3e-980a-48b2-8864-8f389f6a3d3a,Icon sets + data bars for at-a-glance.,,,,,,,,,GoogleSheets,Manual Import: my_insights.csv
Use Track Changes/Compare for SOW redlines,Clean review history reduces legal churn.,Contracting cycles,Risk,3,3,Tactical,Negotiation,Microsoft – Compare docs,https://support.microsoft.com/office/compare-documents-using-the-legal-blackline-option-1e90842f-2628-4ed1-8f5b-9f827b0d17ff,"Prefer DOCX, not PDFs, for redlining.",,,,,,,,,GoogleSheets,Manual Import: my_insights.csv
Use Saga (choreography or orchestration) for multi-step distributed transactions,Choose choreography for simple flows; orchestration for control.,Handle cross-service workflows without 2PC,Efficiency,3,4,Guideline,"Planning, Safety",microservices.io (Chris Richardson,https://microservices.io/patterns/data/saga.html,,,,,,,,,,GoogleSheets,Manual Import: my_insights.csv
Use the Transactional Outbox pattern for reliable events from DB writes,Write to local outbox table then relay asynchronously.,Prevent lost messages on commit/emit races,Efficiency,3,4,Guideline,"Quality Assurance, Safety",microservices.io (Chris Richardson,https://microservices.io/patterns/data/transactional-outbox.html,,,,,,,,,,GoogleSheets,Manual Import: my_insights.csv
Exclude existing customers from TOF awareness spend to avoid wasting budget and overexposing them to brand ads.,Prevents ad fatigue and keeps brand impressions relevant to stage.,Audience hygiene,Efficiency,5,5,checklist item,Audience targeting,Meta for Business Help,https://www.facebook.com/business/help/629864800942497,Meta docs: use exclusion audiences to control delivery.,,,,,,,,,GoogleSheets,Manual Import: my_insights.csv
Avoid unverifiable claims in messaging; anchor value props in benefits you can show and measure.,Over‑promising erodes trust and invites legal risk; proof wins.,Positioning for security/privacy or performance claims.,Clarity,5,4,Guideline,"Messaging, Positioning",meta,https://github.com/monero-project/meta/issues/146,Representative source for rule: provable_claims,,,,,,,,,GoogleSheets,Manual Import: my_insights.csv
Avoid unverifiable claims in messaging; focus on benefits you can prove and demonstrate.,Over‑promising creates legal and trust risks; clear benefits convert better.,Product marketing for privacy/security tools.,Clarity,5,4,Guideline,"Messaging, Positioning",meta,https://github.com/monero-project/meta/issues/146,Mined from GitHub issue via rule: messaging_claims,,,,,,,,,GoogleSheets,Manual Import: my_insights.csv
Send calendar invites with clear titles like 'Kickoff: Marketing Ops Platform (30 mins)' instead of vague labels.,Improves attendance and context-setting.,Calendar hygiene,Efficiency,1,3,Guideline,Clarity/Time Management,Meeting ops playbook,,,,,,,,,,,GoogleSheets,Manual Import: my_insights.csv
Designate a 'decision owner' in every meeting to drive closure.,Prevents endless follow-ups or ambiguity.,Cross-functional meetings,Efficiency,1,3,Tactical,Accountability/Facilitation,Meeting management guide,,,,,,,,,,,GoogleSheets,Manual Import: my_insights.csv
"Prefer 'least surprise' HTTP status codes: 201 for create, 202 for async, 409 for conflicts",Consistent semantics reduce support load.,Make APIs self-explanatory to integrators,Efficiency,3,3,Guideline,"Clarity, Documentation",MDN HTTP status,https://developer.mozilla.org/docs/Web/HTTP/Status,,,,,,,,,,GoogleSheets,Manual Import: my_insights.csv
Cache-validate with ETag/If-None-Match for read-heavy endpoints,Conditional requests avoid full payloads when unchanged.,Reduce bandwidth and speed up reads,Efficiency,3,3,Tactical,"Quality Assurance, Performance Bottlenecks",MDN HTTP caching,https://developer.mozilla.org/docs/Web/HTTP/Headers/ETag,,,,,,,,,,GoogleSheets,Manual Import: my_insights.csv
"For cross-origin PoCs, configure CORS narrowly per route + method","Avoid '*' in production; restrict origins, headers, methods.",Allow just what the browser needs for the PoC,Efficiency,3,3,Guideline,"Safety, Documentation",MDN CORS,https://developer.mozilla.org/docs/Web/HTTP/CORS,,,,,,,,,,GoogleSheets,Manual Import: my_insights.csv
Enforce API request size limits and return 413 with guidance,Document max sizes and recommend ch ing or S3 uploads.,Protect services from oversized payloads,Efficiency,1,3,Guideline,"Quality Assurance, Communication",MDN / RFC 7231,https://developer.mozilla.org/docs/Web/HTTP/Status/413,,,,,,,,,,GoogleSheets,Manual Import: my_insights.csv
"Create 'feature crosses' (e.g., bins × categories) and discretize skewed continuous variables.",Exposes threshold effects and interactions to simpler models.,When trees overfit and linear models underfit.,Efficiency,1,3,Tactical,"Feature Design, Pattern Recognition",Md Asif Ikbal; MOHAMMAD SAAD KHAN (Kaggle,https://www.kaggle.com/discussions/questions-and-answers/477245,Coarse bins reduce noise; tune binning via CV.,,,,,,,,,GoogleSheets,Manual Import: my_insights.csv
Create a glossary for any strategic document over 5 pages to reduce confusion.,Supports cross-functional understanding.,Strategy or planning docs,Efficiency,2,3,Guideline,Clarity/Documentation,McKinsey Writing Standards,,,,,,,,,,,GoogleSheets,Manual Import: my_insights.csv
Use a 'single sentence summary' at the top of strategy docs to align diverse readers quickly.,Helps non-domain leaders grasp core message fast.,Quarterly strategy presentations,Efficiency,1,3,Guideline,Clarity/Executive Alignment,McKinsey internal doc format,,,,,,,,,,,GoogleSheets,Manual Import: my_insights.csv
"In fast-changing orgs, revisit RACI matrices quarterly to avoid hidden ownership drift.",Keeps clarity as orgs evolve quickly.,Team role clarity,Efficiency,1,4,pattern,Accountability/Internal Politics,McKinsey execution guidance,,,,,,,,,,,GoogleSheets,Manual Import: my_insights.csv
"As a facilitator, don't use the meeting as your platform—focus on encouraging high‑quality conversations among participants rather than pushing your own views","The facilitator's role is to guide conversation, not promote personal opinions【580191659819919†screenshot】",Workshop mindset,Efficiency,2,4,cue,Facilitation,Matthew Skelton blog,,,,,,,,,,,GoogleSheets,Manual Import: my_insights.csv
"Before facilitating a round-table, research participants' backgrounds and expectations and write down their names; ensure everyone introduces themselves",Prepare by understanding participants and noting their names to encourage introductions【93329248034715†screenshot】,Workshop preparation,Efficiency,2,3,Tactical,Facilitation,Matthew Skelton blog,,,,,,,,,,,GoogleSheets,Manual Import: my_insights.csv
Encourage quieter participants by calling them by name and gently redirecting over‑talkers so everyone has a chance to speak,Call quieter people by name and redirect chatty participants to ensure everyone speaks【580191659819919†screenshot】,Inclusive discussion,Efficiency,2,4,cue,Facilitation,Matthew Skelton blog,,,,,,,,,,,GoogleSheets,Manual Import: my_insights.csv
"Keep the discussion on track: periodically check against your list of questions, ask bridging questions to move between topics, and finish on time with a summary of key points",Use bridging questions and summaries to cover key points and end on time【936883547210704†screenshot】【5753063827603†screenshot】,Time management in workshops,Efficiency,2,3,Tactical,Facilitation,Matthew Skelton blog,,,,,,,,,,,GoogleSheets,Manual Import: my_insights.csv
"Prepare the discussion topic thoroughly: know enough about the subject, create a list of guiding questions, share them with participants and include a little controversy to spark debate","Facilitators should prepare questions and understand the topic, sharing them ahead of time and adding controversy if needed【580191659819919†screenshot】",Workshop planning,Efficiency,2,4,Tactical,Facilitation,Matthew Skelton blog,,,,,,,,,,,GoogleSheets,Manual Import: my_insights.csv
"Map 'moments × goals' before ideation; design content that helps the customer accomplish a goal in each moment, across the lifecycle.",Context marketing aligns artifacts to real customer motivation instead of generic funnels.,Planning a content/program roadmap tied to customer journeys.,Efficiency,2,3,Guideline,"Pattern Recognition, Planning",Mathew Sweezey (interview quotes,https://wellspringdigital.com/blog/tasty-nuggets-of-wisdom-from-todays-top-marketers-part-one/,"Two‑step frame: focus on goals-in-moments, then apply across lifecycle.",,,,,,,,,GoogleSheets,Manual Import: my_insights.csv
Mastercard 4808: avoid authorization‑related chargebacks—final capture should match auth amount or be re‑authorized; observe authorization validity windows.,Mastercard rules define 4808 conditions and protection windows.,E‑commerce capture/adjust flows.,Efficiency,2,3,Guideline,"Clarity, Testing",Mastercard Transaction Processing Rules (June 2025,https://www.mastercard.com/content/dam/mccom/shared/business/support/rules-pdfs/transaction-processing-rules.pdf,"Avoid partial, stale captures that exceed allowed timelines.",,,,,,,,,GoogleSheets,Manual Import: my_insights.csv
Prevent Mastercard 4808 chargebacks: capture/finalize correctly—settled amount must equal authorized amount; observe preauth time limits.,Mastercard rules define 4808 authorization‑related chargebacks and protection periods.,E‑commerce capture flows and post‑auth edits.,Efficiency,2,3,Guideline,"Clarity, Testing",Mastercard Transaction Processing Rules (June 2025,https://www.mastercard.com/content/dam/mccom/shared/business/support/rules-pdfs/transaction-processing-rules.pdf,Avoid partial captures unless re‑authorized; align with protection windows.,,,,,,,,,GoogleSheets,Manual Import: my_insights.csv
Mastercard Account Updater (VAU/ABU): enroll to receive updated PAN/expiry for recurring billing; reduces involuntary churn.,Networks offer updaters to keep credentials current after reissue/expiry.,Subscription/card‑on‑file programs.,Revenue,1,3,Guideline,"Forecasting, Productivity",Mastercard Automatic Billing Updater,https://www.mastercard.us/en-us/business/issuers/products-and-solutions/automatic-billing-updater.html,Combine with retry logic tuned to issuer behaviors.,,,,,,,,,GoogleSheets,Manual Import: my_insights.csv
Adopt optimistic concurrency with entity version fields to prevent lost updates,Include ETag/If-Match or version column to detect conflicts.,Protect concurrent writes in APIs,Efficiency,1,3,Guideline,"Quality Assurance, Documentation",Martin Fowler (Patterns of Enterprise Application Architecture,https://martinfowler.com/eaaCatalog/optimisticOfflineLock.html,,,,,,,,,,GoogleSheets,Manual Import: my_insights.csv
Use 'expand/contract' DB changes to avoid downtime,Keeps migrations safe and reversible.,Schema-changing features,Efficiency,2,3,Guideline,Quality Assurance,Martin Fowler – Parallel Change,https://martinfowler.com/bliki/ParallelChange.html,"Plan additive, migrate, then remove old.",,,,,,,,,GoogleSheets,Manual Import: my_insights.csv
Create feature toggles for long-running work (branch by abstraction),Avoids long-lived branches; ship incrementally.,Large refactors or risky features,Efficiency,1,3,Guideline,Technical Debt,Martin Fowler – Feature Toggles,https://martinfowler.com/articles/feature-toggles.html,Release independently of deploy.,,,,,,,,,GoogleSheets,Manual Import: my_insights.csv
"The best content addresses a specific pain, not just your product's features.","This wisdom focuses on solving the customer's problem first, which builds trust and positions your company as a helpful resource. The product is then presented as the solution.",A marketing team is brainstorming new content ideas.,"Revenue, Strategic Planning",5,5,Rule-of-thumb,"Content Marketing, Strategic Planning",MarketingProfs Blog,,"A common mistake is to ""talk about yourself too much.""",,,,,,,,,GoogleSheets,Manual Import: my_insights.csv
"To show the value of marketing to the CMO, create a single dashboard that shows the entire customer journey.","This dashboard should show the flow of a customer from first touch to revenue, demonstrating how marketing activities contribute to the bottom line.",A marketing leader is preparing for a quarterly business review with the C-suite.,"Strategic Planning, Communication",5,5,Checklist Item,"Analysis, Strategic Planning",MarketingProfs Blog,,"The key is to tell a story with the data, not just present a list of numbers.",,,,,,,,,GoogleSheets,Manual Import: my_insights.csv
"Review funnel metrics (CTR, CVR, CAC) alongside brand health KPIs (share of search, aided recall) in monthly performance decks.",Prevents short‑term optimizations from eroding brand equity and future demand.,Integrated KPI review,Revenue,5,3,checklist item,Measurement,Mark Ritson (Marketing Week column),https://www.marketingweek.com/mark-ritson-measurement/,Ritson advocates tracking brand and activation together for full-funnel ROI.,,,,,,,,,GoogleSheets,Manual Import: my_insights.csv
Send a 'before we meet' agenda the day prior to reduce context-switching at the start.,Boosts clarity and prep quality.,Team syncs or stakeholder meetings,Efficiency,2,4,cue,Facilitation/Communication,Manager Tools Podcast,,,,,,,,,,,GoogleSheets,Manual Import: my_insights.csv
Publish a security policy with a responsible disclosure process and a private intake channel.,Clear paths for reporting reduce time‑to‑fix and legal risk.,Any product with external users or partners.,Safety,5,4,Guideline,"Safety, Accountability",lucene,https://github.com/apache/lucene/issues/10119,Representative source for rule: security_policy,,,,,,,,,GoogleSheets,Manual Import: my_insights.csv
"Defaulting to channels instead of DMs improves transparency, searchability, and institutional memory across teams.","Work conducted in channels is visible to all, providing context to current and future team members while reducing duplication and improving knowledge continuity.",Communication norm setting,Efficiency,5,5,rule-of-thumb,Documentation,Lucas Puente,https://slack.com/blog/productivity/how-slack-power-users-get-more-done,Applies broadly in remote and hybrid teams.,,,,,,,,,GoogleSheets,Manual Import: my_insights.csv
Power users automate repetitive tasks in Slack using workflows and integrations to improve team responsiveness and reduce manual updates.,"Automations keep work flowing without requiring human follow-ups and ensure consistency in responses, especially for FAQs or onboarding.",Internal operations automation,Efficiency,5,5,workaround,Pattern Recognition,Lucas Puente,https://slack.com/blog/productivity/how-slack-power-users-get-more-done,Users report 26% higher productivity using automations.,,,,,,,,,GoogleSheets,Manual Import: my_insights.csv
"Slack power users customize notifications, sidebars, and visual themes to shape the workspace around how they work best.","Personalized settings reduce distraction and cognitive load, enabling faster focus and task switching.",Workflow customization,Efficiency,4,4,pattern,Clarity,Lucas Puente,https://slack.com/blog/productivity/how-slack-power-users-get-more-done,Customization noted as a consistent trait of power users.,,,,,,,,,GoogleSheets,Manual Import: my_insights.csv
Use Loom 3-minute walkthroughs instead of status meetings,Cuts meetings while keeping stakeholders warm.,Explaining complex changes quickly,Efficiency,3,3,Tactical,Time Management,Loom blog + practice,https://www.loom.com/blog,Caption + chapter the video.,,,,,,,,,GoogleSheets,Manual Import: my_insights.csv
"In onboarding docs, bold action verbs and include screenshots for each step.",Improves scanability and usability.,New hire or customer onboarding,Retention,2,4,Tactical,Documentation/Enablement,Loom Blog,,,,,,,,,,,GoogleSheets,Manual Import: my_insights.csv
"After sprint planning, post a video walkthrough of the board for async alignment.",Saves meeting time and improves clarity.,Remote scrum team planning,Efficiency,3,3,Tactical,Communication/Enablement,Loom Agile Use Cases,,,,,,,,,,,GoogleSheets,Manual Import: my_insights.csv
Use a one-line 'why this matters' on every dashboard metric card.,Improves business context for non-analysts.,BI tool setup,Efficiency,1,3,Tactical,Enablement/Forecasting,Looker Community Best Practices,,,,,,,,,,,GoogleSheets,Manual Import: my_insights.csv
"Don't just say ""no"" to a business unit's spending request. Say, ""Yes, and here's what it will take.""","This shifts the conversation from being an obstacle to being a partner. It allows you to present the trade-offs and help the business unit prioritize their goals, becoming a strategic advisor.",A sales team leader asks for a larger budget for a new initiative.,"Collaboration, Efficiency",5,5,Workaround,"Negotiation, Strategic Planning",LinkedIn Post from Finance Leader,,"The ""what it will take"" part of the phrase is where you build value and trust.",,,,,,,,,GoogleSheets,Manual Import: my_insights.csv
"When you're asked to present financial data to leadership, use a ""30-10-5"" rule. The first 30 seconds should be the most important takeaway, the next 10 minutes are for the supporting evidence, and the last 5 are for Q&A and next steps.","This rule ensures that even the busiest executive can get the main point of your presentation, making you a more efficient and valued contributor.",Presenting a financial analysis to a group of busy executives.,"Communication, Efficiency",5,5,Rule-of-thumb,"Presentations, Analysis",LinkedIn Post from Finance Leader,,A common mistake is to get lost in the weeds and not get to the point.,,,,,,,,,GoogleSheets,Manual Import: my_insights.csv
