description,rationale,use_case,impact_area,transferability_score,actionability_rating,type_(form),tag_(application),source_(interview_#/_name),link,notes,evidence_strength,unique?,role,function,company,industry,country,date,source,filepath
Require PMs to include a 'support load impact' estimate in new feature briefs.,Aligns product growth with ops capacity.,Product development intake,Efficiency,1,3,Guideline,Feature Design/Resource Management,Zendesk PM Best Practices,,,,,,,,,,,GoogleSheets,Manual Import: my_insights.csv
The product's external website is often the best source for sales reps.,"An external site is often the most updated and consistent source of information on products, promos, and pricing.",Creating a single source of truth for a sales team.,Efficiency,4,3,warning,Sales Enablement,zenabled.weebly.com,http://zenabled.weebly.com/customer-interviews.html,This is a red flag about internal knowledge management and communication failures.,,,,,,,,,GoogleSheets,Manual Import: my_insights.csv
Avoid multitasking by focusing on one thing at a time.,Constantly switching between tasks leads to more errors and takes longer to finish the work.,Day-to-day work for a PM.,Efficiency,5,5,rule-of-thumb,Time Management,zeda.io/blog/productivity-hacks-for-product-managers,It's better to work through a prioritized list sequentially to achieve more with fewer errors.,,,,,,,,,,GoogleSheets,Manual Import: my_insights.csv
"Implement the ""4 D's"" rule: Do, Delegate, Defer, or Delete.","This framework helps triage a constant influx of tasks, reducing mental clutter and improving focus.",Managing a busy day with competing priorities.,Efficiency,5,5,rule-of-thumb,Time Management,zeda.io/blog/productivity-hacks-for-product-managers,The most effective hack is to delete tasks that don't advance any of your goals.,,,,,,,,,,GoogleSheets,Manual Import: my_insights.csv
"Use the ""2-minute rule"" to handle small tasks immediately.",Postponing simple tasks like sending an email creates a backlog and adds unnecessary mental burden.,Daily task management for a PM.,Efficiency,5,5,rule-of-thumb,Time Management,zeda.io/blog/productivity-hacks-for-product-managers,Prevents a to-do list from becoming a source of stress and mental fog.,,,,,,,,,,GoogleSheets,Manual Import: my_insights.csv
"When AI-generated code fails, reframe the prompt as if the code was written by you to get better debugging help.","LLMs often respond more helpfully when asked to fix user-written code rather than defend their own prior output, reducing hallucinated justifications.",Debugging with AI tools,Efficiency,5,5,workaround,Workaround,Yaroslav Lapin (LinkedIn Post,https://www.linkedin.com/posts/yaroslav-lapin_pro-tip-since-gpt-5-is-very-good-at-activity-7100000000000000000,A workaround reflecting behavioral patterns of LLMs like GPT-5 when approached with reframed prompts.,,,,,,,,,GoogleSheets,Manual Import: my_insights.csv
Take 5–10 minutes pre-meeting to list what you'll say and what input you need from seniors.,Makes check-ins decisive; shows ownership of your workstream.,Manager/partner catch-ups; internal standups.,Efficiency,1,4,cue,"Planning, Communication","WSO user ""Works at Bain"" (Most Helpful",https://www.wallstreetoasis.com/forum/consulting/year-1-in-consulting-tips-tricks-advice-and-unspoken-rules,Treat every touchpoint like a mini-review with a clear ask.,,,,,,,,,GoogleSheets,Manual Import: my_insights.csv
Listen first; try to infer the rationale before asking 'why not X?'.,Keeps velocity high when seniors can't over-explain every task.,Receiving tasks from case lead/partner.,Efficiency,1,4,cue,"Team Dynamics, Communication","WSO user ""Works at Bain""",https://www.wallstreetoasis.com/forum/consulting/year-1-in-consulting-tips-tricks-advice-and-unspoken-rules,Ask sharper questions after an initial pass.,,,,,,,,,GoogleSheets,Manual Import: my_insights.csv
Never 'Reply All' blindly; re-address only those who need the update.,Prevents accidental client exposure of drafts/sensitive context.,Long email chains with mixed client/vendor recipients.,Efficiency,1,2,warning,"Safety, Communication","WSO user ""Works at Bain""",https://www.wallstreetoasis.com/forum/consulting/year-1-in-consulting-tips-tricks-advice-and-unspoken-rules,Double-check recipients when forwarding internal commentary.,,,,,,,,,GoogleSheets,Manual Import: my_insights.csv
"In project intake forms, include 'what happens if this doesn't get done' to force priority thinking.",Surfaces real urgency vs. noise.,Work intake processes,Efficiency,1,4,Mental Mode,Prioritization/Requirements,Workfront Admin Forum,,,,,,,,,,,GoogleSheets,Manual Import: my_insights.csv
"Own data migration: define source-of-truth, reconciliation reports, and who signs off record-level accuracy before cutover.","SIs configure, but business owns meaning of data; sign-off prevents post go-live chaos.",ERP/CRM implementation data workstreams.,,4,4,Guideline,Data Hygiene; Accountability,Workday client lessons (Raven Intel) & Bolt implementation post,https://ravenintel.com/workdayimplementation/,,,,,,,,,,GoogleSheets,Manual Import: my_insights.csv
Run joint design workshops with business 'super users' and make them UAT leads; reduces rework and lifts adoption.,Super users become advocates & trainers post go-live.,ERP/CRM process design & testing with SI.,,4,4,Pattern,Stakeholder Alignment; Enablement,Workday – Bolt case; Surety Systems client takeaways,https://blog.workday.com/en-gb/5-valuable-lessons-learned-from-bolts-workday-implementation.html,,,,,,,,,,GoogleSheets,Manual Import: my_insights.csv
"Use a GTM positioning statement with fields for [Target Customer] For:, [Need/Opportunity] Who:, [Product Category] is:, [Key Benefit] That:, and [Competitive Alternative] Unlike:",Provides a structured way to define positioning and differentiation across product lines or messaging exercises.,"Marketing, Sales Enablement, GTM Strategy",Clarity,4,4,Framework,"Positioning, Messaging",William Davis LinkedIn post,https://www.linkedin.com/posts/williamdavis123_messaging-positioning-frameworks-activity-6903478170305792000-Ytj9,Also includes persona mapping logic and guidance on using a structured framework for buyer types in enterprise deals.,,,,,,,,,GoogleSheets,Manual Import: my_insights.csv
"Positioning Statement Framework including Target Customer, Need, Product, Key Benefit, and Competitive Alternative.",Provides a structured approach to differentiate GTM messaging.,"Product launch, Market messaging, GTM content development","Product Marketing, GTM Strategy",5,4,Messaging Template,"Positioning, Product Messaging",William Davis,,"Commonly used structure, included in shared screenshot with other frameworks",,,,,,,,,GoogleSheets,Manual Import: my_insights.csv
Use Western Electric run rules on SPC charts to catch non-random patterns early.,Supplementary rules detect subtle drift before points exceed 3σ limits.,Daily SPC reviews on critical characteristics.,Efficiency,3,3,Guideline,"Quality Assurance, Testing",Wikipedia — Western Electric Rules (reference standard,https://en.wikipedia.org/wiki/Western_Electric_rules,Rules 1–4: 1 beyond 3σ; 2/3 beyond 2σ; 4/5 beyond 1σ; 8 on one side.,,,,,,,,,GoogleSheets,Manual Import: my_insights.csv
"Align creative with lifecycle stage—education for early‑stage users, and urgency/incentives for late‑stage prospects; don’t mix signals.",Stage‑appropriate messaging increases relevance and conversion likelihood by matching mindset.,Lifecycle creative alignment,Revenue,5,4,pattern,Creative sequencing,WhatConverts blog,https://www.whatconverts.com/blog/retargeting-ad-examples/,Use education/problem‑aware creatives at TOF; urgency/offer for BOF.,,,,,,,,,GoogleSheets,Manual Import: my_insights.csv
Don't just log error codes — log the *decision path* leading to them,Debugging without context leads to guesswork,Postmortem prep,Safety,3,5,Guideline,"Logging, Judgment",What logging saved your ass?,https://news.ycombinator.com/item?id=38815032,Standout comment + 50+ upvotes,,,,,,,,,GoogleSheets,Manual Import: my_insights.csv
Stand up a visible Andon (lights/boards) to surface problems in real time and empower stops.,Visual controls shorten time-to-response and enable long-term fixes.,Manual stations and mixed-model lines.,Efficiency,1,3,Guideline,"Feedback Loops, Safety",Vorne — Andon definition & benefits,https://www.vorne.com/learn/key-concepts/andon/,Pair with clear escalation playbook.,,,,,,,,,GoogleSheets,Manual Import: my_insights.csv
"For recurring card billing, send Account Status Inquiry (ASI) or use Updater before retrying to avoid wasted declines after reissue.",Networks support account updater/ASI to check credential freshness.,Smart retry logic for subscription payments.,Efficiency,1,3,Guideline,"Planning, Performance Bottlenecks",Visa/Mastercard Updater programs,https://www.mastercard.us/en-us/business/issuers/products-and-solutions/automatic-billing-updater.html,Reduce issuer soft declines by verifying status first.,,,,,,,,,GoogleSheets,Manual Import: my_insights.csv
"Use dispute reason‑code‑specific templates; e.g., Visa 13.3 'Not As Described' needs refund/return policy evidence, not login/IP.",Mapping evidence to reason code increases win rate and reduces 'insufficient evidence' losses.,Chargeback response assembly at scale.,Revenue,2,4,Tactical,"Deal Control, Documentation",Visa/Mastercard reason code guides,https://www.mastercard.com/content/dam/mccom/global/documents/chargeback-guide.pdf,Wrong evidence wastes your one CE3.0 attempt for 10.4.,,,,,,,,,GoogleSheets,Manual Import: my_insights.csv
Use Visa VTC (Visa Token Service) or network tokens to maintain authorization continuity through card reissues.,"Network tokens update underlying PAN changes, improving approval and reducing churn.",Recurring/subscription payments continuity.,Revenue,3,3,Guideline,"Enablement, Productivity",Visa Token Service overview,https://usa.visa.com/run-your-business/visa-token-service.html,Pair with Account Updater for PANs not tokenized.,,,,,,,,,GoogleSheets,Manual Import: my_insights.csv
Use 'soft descriptor' fields where supported to show product/site context and reduce recognition disputes.,Network guidance encourages recognizable descriptors to cut friendly fraud.,Lowering 'I don't recognize' chargebacks.,Efficiency,4,4,Guideline,"Clarity, Communication",Visa Merchant Guidelines,https://usa.visa.com/dam/VCOM/global/support-legal/documents/merchants-dispute-management-guidelines.pdf,Test how the descriptor renders across issuers.,,,,,,,,,GoogleSheets,Manual Import: my_insights.csv
"In CE 3.0 disputes, include device fingerprint, IP, login, delivery address, and usage logs; missing any required element can void the submission.",Visa's CE 3.0 table defines required combinations—submissions are single‑shot.,CNP fraud (10.4) responses.,Efficiency,1,3,Tactical,"Documentation, Deal Control",Visa Dispute Management Guidelines (June 2024,https://usa.visa.com/dam/VCOM/global/support-legal/documents/merchants-dispute-management-guidelines.pdf,Automate data extraction from order systems.,,,,,,,,,GoogleSheets,Manual Import: my_insights.csv
Use Visa's June 2024 dispute guide to target allowable evidence under 10.4 (Card‑Absent).,The guide lists evidence types Visa considers compelling across scenarios.,Assembling dispute packs for CNP fraud claims.,Efficiency,5,3,Data Source,"Enablement, Documentation",Visa Dispute Management Guidelines (June 2024,https://usa.visa.com/dam/VCOM/global/support-legal/documents/merchants-dispute-management-guidelines.pdf,Cross‑reference table for CE3.0 evidence elements.,,,,,,,,,GoogleSheets,Manual Import: my_insights.csv
"Map CE 3.0 fields (device ID, IP, login, shipping) into receipts/order records so disputes can be auto‑assembled.",Visa details which evidence qualifies as compelling for CNP fraud disputes.,"Faster, stronger dispute responses for reason code 10.4.",Efficiency,3,3,Tactical,"Documentation, Enablement",Visa Dispute Management Guidelines (June 2024,https://usa.visa.com/dam/VCOM/global/support-legal/documents/merchants-dispute-management-guidelines.pdf,You only get one CE3.0 shot—validate completeness before submission.,,,,,,,,,GoogleSheets,Manual Import: my_insights.csv
Use Visa Secure (3‑D Secure) to shift liability off the merchant when authentication succeeds.,Visa states merchants are protected from certain fraud disputes with 3‑D Secure when processed correctly.,Reducing e‑commerce fraud disputes.,Efficiency,1,3,Guideline,"Risk, Ghosting Prevention",Visa Dispute Management Guidelines (June 2024,https://usa.visa.com/dam/VCOM/global/support-legal/documents/merchants-dispute-management-guidelines.pdf,Check regional liability shift nuances.,,,,,,,,,GoogleSheets,Manual Import: my_insights.csv
Make sure your statement descriptor (DBA + city/state) is recognizable to reduce 'I don't recognize it' disputes.,Visa advises ensuring customers recognize the merchant name on statements.,Lowering friendly‑fraud/recognition disputes.,Efficiency,4,4,Guideline,"Clarity, Communication",Visa Dispute Management Guidelines,https://usa.visa.com/dam/VCOM/global/support-legal/documents/merchants-dispute-management-guidelines.pdf,Test live with small purchase to see how it renders.,,,,,,,,,GoogleSheets,Manual Import: my_insights.csv
"In Visa CE3.0, you only get one shot—assemble the VROL pre‑arb with all required data (device ID, IP, etc.).",Visa readiness doc: incorrect/incomplete CE3.0 submissions are declined; single attempt per case.,Preparing a CE3.0 response for 10.4 disputes (CNP fraud).,Efficiency,1,3,Tactical,"Documentation, Deal Control",Visa CE3.0 Merchant Readiness,https://usa.visa.com/content/dam/VCOM/regional/na/us/support-legal/documents/compelling-evidence-3.0-merchant-readiness-mar2023.pdf,"Map evidence at order time so it's exportable (login ID, device, IP, shipping).",,,,,,,,,GoogleSheets,Manual Import: my_insights.csv
"For CE 3.0, include device fingerprint/IP plus at least one other data point for digital goods disputes.",Visa CE tables detail accepted evidence sets for 10.4 disputes.,Preparing chargeback responses for card‑not‑present.,Efficiency,1,3,Tactical,"Documentation, Dispute Win",Visa CE 3.0 table (June 2024,https://usa.visa.com/dam/VCOM/global/support-legal/documents/merchants-dispute-management-guidelines.pdf,"See table items 4 & 10 effective Oct 19, 2024.",,,,,,,,,GoogleSheets,Manual Import: my_insights.csv
"Map CE 3.0 evidence fields (e.g., login ID, delivery address) into your receipts for faster dispute assembly.",Visa lists discrete data elements that qualify as compelling evidence.,Building auto‑packaged dispute responses.,Efficiency,3,3,Tactical,"Documentation, Enablement",Visa CE 3.0 table,https://usa.visa.com/dam/VCOM/global/support-legal/documents/merchants-dispute-management-guidelines.pdf,Capture at order time; store securely.,,,,,,,,,GoogleSheets,Manual Import: my_insights.csv
"At the end of user research, record a short video recap for stakeholders.",Makes findings more accessible and engaging.,Post-research synthesis,Efficiency,3,3,Tactical,Communication/Enablement,UX Research Ops Guide,,,,,,,,,,,GoogleSheets,Manual Import: my_insights.csv
"Summarize every user research call with 3 bullets: surprise, concern, confirmation.",Helps capture qualitative signal quickly.,UX research analysis,Efficiency,2,3,Guideline,Discovery/Feedback Loops,UX research blog,,,,,,,,,,,GoogleSheets,Manual Import: my_insights.csv
"Use the '0, 1, 3' rule in UI design: default to zero clicks, one field, or three choices.",Keeps flows fast and intuitive.,Product UX reviews,Efficiency,2,3,Guideline,Feature Design/Enablement,UX heuristic library,,,,,,,,,,,GoogleSheets,Manual Import: my_insights.csv
Use 'lo-fi demos' (hand-drawn or figma wireframes) early to validate direction fast.,Reduces rework before dev begins.,Product discovery,Efficiency,1,3,Tactical,Feature Design/Feedback Loops,UX Collective,,,,,,,,,,,GoogleSheets,Manual Import: my_insights.csv
"Use the 'two tabs rule' when designing onboarding: if users need more than two tabs to complete a task, simplify.",Keeps early UX friction low.,New user experience design,Retention,1,4,Guideline,Enablement/Feature Design,UX case study,,,,,,,,,,,GoogleSheets,Manual Import: my_insights.csv
Make the ad headline and landing-page H1 identical; keep visuals and CTA consistent from ad → email → landing → thank-you to preserve 'conversion scent'.,"Consistency reassures visitors they’re in the right place, reduces cognitive load, increases relevancy/quality, and lifts conversions.",Message match across paid ads and landing pages,Revenue,5,5,rule-of-thumb,Message match,Unbounce (Chin Tan; Ryan Watson); KlientBoost,https://unbounce.com/landing-page-examples/high-converting-landing-pages/,See Later example (email+ad+LP alignment) and onX example; keep the same headline; use dynamic text if needed.,,,,,,,,,GoogleSheets,Manual Import: my_insights.csv
Maintain conversion scent end‑to‑end: ad → email → pre‑LP creative → landing page—with the same offer and visual cues.,Cross‑channel consistency prevents confusion and drop‑off while reinforcing the brand promise.,Cross‑channel campaign consistency,Revenue,5,4,rule-of-thumb,Message match,"Unbounce (Chin Tan, Later)",https://unbounce.com/landing-page-examples/high-converting-landing-pages/,Keep TOF forms short; the ask should match the value of the offer.,,,,,,,,,GoogleSheets,Manual Import: my_insights.csv
Create a separate mobile landing experience (lighter assets) while keeping the brand look identical to desktop; optimize mobile-first.,"Mobile-first load speed and clarity reduce drop-offs while preserving brand cues, improving conversions on mobile traffic.",Mobile landing optimization,Revenue,5,3,pattern,Mobile optimization,"Unbounce (Aditya Bagri, WITHIN)",https://unbounce.com/landing-page-examples/high-converting-landing-pages/,Keep creative consistent; use a lighter mobile variant to maintain speed without losing brand cues.,,,,,,,,,GoogleSheets,Manual Import: my_insights.csv
"Define telemetry minimums for new features (key events, timing, errors) before coding starts.",Instrumentation retrofits rarely happen; define what 'good' looks like up front.,Feature delivery; growth experiments.,Enablement,5,4,Guideline,"Clarity, Accountability",ultralytics,https://github.com/ultralytics/ultralytics/issues/1915,Representative source for rule: telemetry_minimums,,,,,,,,,GoogleSheets,Manual Import: my_insights.csv
Prefer ULID over UUID v4 when sortability matters,"Lexicographically sortable, 128-bit, base32 Crockford.",Keep inserts mostly time-ordered and human-usable,Efficiency,1,3,Guideline,"Performance Bottlenecks, Data Hygiene",ULID Spec (GitHub,https://github.com/ulid/spec,,,,,,,,,,GoogleSheets,Manual Import: my_insights.csv
"In stakeholder reviews, focus on what a few key data points mean—not the wall of data.",Senior planners screen for ability to translate data to decision guidance.,Junior strategist presenting a POV to hiring manager or client.,Efficiency,1,4,cue,"Translation, Communication",u/Princenomad (Assoc. Planning Director,https://www.reddit.com/r/advertising/comments/s7rm8n/if_youre_into_strategyplanning_how_did_you_get/,Be able to conversationally talk about what the data means for the project.',,,,,,,,,GoogleSheets,Manual Import: my_insights.csv
Most responsible person decides' and others disagree‑and‑commit.,Ownership concentrates decision rights with the person whose outcome is on the line.,When consensus stalls and timelines slip.,Efficiency,2,3,Mental Mode,"Accountability, Escalation",u/lord_braleigh,https://www.reddit.com/r/ExperiencedDevs/comments/1lioce6/how_to_handle_an_engineer_who_prefers_hacks_vs/,A management pattern echoed by multiple replies.,,,,,,,,,GoogleSheets,Manual Import: my_insights.csv
"Require a short design doc + effort estimate from each approach; in parallel, ship a quick POC with the off‑the‑shelf tool.",Side‑by‑side artifacts make decision criteria explicit and unblock stalemates.,Tech stack dispute resolution.,Efficiency,1,3,Tactical,"Deal Control, Escalation",u/light-triad; u/Antique-Stand-4920; u/mmcnl,https://www.reddit.com/r/ExperiencedDevs/comments/1lioce6/how_to_handle_an_engineer_who_prefers_hacks_vs/,Follow with a decision doc weighing pros/cons vs. requirements.,,,,,,,,,GoogleSheets,Manual Import: my_insights.csv
"Write requirements as measurable bullets (e.g., GB/day throughput, SQL‑expressible transforms, horizontal scaling, scheduling, observability).",Concrete requirements depersonalize the debate and frame solution trade‑offs.,Choosing between custom code vs. standard ETL/ELT tools.,Efficiency,1,3,Guideline,"Requirements, Clarity",u/light-triad (top reply,https://www.reddit.com/r/ExperiencedDevs/comments/1lioce6/how_to_handle_an_engineer_who_prefers_hacks_vs/,Use the same bullets to evaluate designs and POCs.,,,,,,,,,GoogleSheets,Manual Import: my_insights.csv
Protect creative focus: route account feedback through strategy/CD—don't let accounts work creators directly.,Maintains clarity of brief and prevents politics from derailing creative work.,Agency client feedback cycles.,Efficiency,1,3,Guideline,"Deal Control, Internal Politics",u/JeffryRelatedIssue,https://www.reddit.com/r/advertising/comments/s7rm8n/if_youre_into_strategyplanning_how_did_you_get/,Advice given to rookies entering planning teams.,,,,,,,,,GoogleSheets,Manual Import: my_insights.csv
Define DoD for 'the strategy' up front: a 1‑page exec summary + a research/readout deck with next‑step recs.,Clients often want a simple 'strategy artifact'; pre‑agreeing format reduces swirl.,Kickoff with stakeholders who ask for 'a strategy on paper'.,Efficiency,1,4,Guideline,"Scoping, Executive Alignment",u/Intelligent_Place625,https://www.reddit.com/r/marketing/comments/1icj79m/what_are_your_strategy_hacks/,Thread also notes that one‑pagers beat 50‑slide decks for clarity.,,,,,,,,,GoogleSheets,Manual Import: my_insights.csv
"Structure strategy docs with OGSM (Objectives, Goals, Strategies, Measures) to separate 'what/why' from 'how'.",OGSM keeps strategy distinct from tactics and makes review criteria explicit.,Writing a marketing strategy one‑pager for execs.,Efficiency,3,3,Tactical,"Clarity, Documentation",u/BigRedTone (top reply,https://www.reddit.com/r/marketing/comments/1icj79m/what_are_your_strategy_hacks/,Example in thread uses CRO goals and staged measures.,,,,,,,,,GoogleSheets,Manual Import: my_insights.csv
Prefer ELT over ETL when your stack supports it.,Keeping raw data intact simplifies debugging and scaling compute in‑warehouse.,Designing first‑gen pipelines on modern warehouses.,Efficiency,4,3,Guideline,"Data Hygiene, Testing",u/angrathias (+ reply thread,https://www.reddit.com/r/ExperiencedDevs/comments/1lioce6/how_to_handle_an_engineer_who_prefers_hacks_vs/,Qualification: only when your ELT platform is the system of record.,,,,,,,,,GoogleSheets,Manual Import: my_insights.csv
"Budget operational metrics into the choice: current jobs, GB/runtime now and at growth, build time per new job, MTTR with/without observability.",Opex comparisons expose hidden costs of 'quick hacks'.,Business case for platform vs. bespoke.,Efficiency,1,3,Guideline,"Forecasting, Performance Bottlenecks",u/absinthe718,https://www.reddit.com/r/ExperiencedDevs/comments/1lioce6/how_to_handle_an_engineer_who_prefers_hacks_vs/,Use these as budgeting inputs and decision criteria.,,,,,,,,,GoogleSheets,Manual Import: my_insights.csv
Use plain .md files and YAML front matter to structure a personal knowledge base that's natively readable by AI tools.,"Markdown avoids formatting issues and proprietary systems, allowing AI to process and retrieve structured information more accurately and flexibly.",Personal knowledge management for AI assistants,Efficiency,5,5,workaround,Documentation,Tyler Folkman (LinkedIn Post,https://www.linkedin.com/posts/tylerfolkman_markdown-ai-productivity-activity-7100000000000000000,Recommended apps: iA Writer + Working Copy + GitHub. YAML helps structure data at the top of markdown for improved parsing.,,,,,,,,,GoogleSheets,Manual Import: my_insights.csv
Validate and sign webhook payloads; retry with backoff on 5xx/timeouts,"Docs cover signing, validation, retries, and timeouts.",Make integrations robust to transient failures,Efficiency,3,3,Guideline,"Safety, Quality Assurance",Twilio Webhooks Best Practices,https://www.twilio.com/docs/usage/webhooks/webhooks-best-practices,,,,,,,,,,GoogleSheets,Manual Import: my_insights.csv
Build a waitlist and segment it; invite in waves that match current capability.,Prevents churn while maximizing learning with the right early users.,Private beta recruitment and iteration.,Revenue,1,3,Tactical,"Discovery, Feedback Loops",Tuomas Artman (Linear,https://linear.app/now/rethinking-the-startup-mvp-building-a-competitive-product,"Ask sign-ups about tools, role, size, pet peeves to filter invites.",,,,,,,,,GoogleSheets,Manual Import: my_insights.csv
Narrow your ICP to the smallest viable group; build the 'smallest atomic unit' that serves them exceptionally.,"In saturated markets, sharper focus is how you out-execute.",Early-stage product strategy.,Efficiency,1,3,Guideline,"Scoping, Feature Design",Tuomas Artman (Linear,https://linear.app/now/rethinking-the-startup-mvp-building-a-competitive-product,Linear started with ICs at small startups and issue tracking.,,,,,,,,,GoogleSheets,Manual Import: my_insights.csv
